score,content
5,"대부분 뭔가 서브컬쳐 게임들은 망하거나 만들어갈때 포기 하는경우가 많은데, 이번 명일방주: 엔드필드, 게임은 다르군요. 너무 재미있으면서도 퀼리티가 상당히 좋습니다."
3,붕괴3때 가챠랑 발열때문에 폰겜으로 나온 오픈월드게임은 대부분 걸렀는데...재밌게하던 게임에서 만들었다길래 해본 소감으론..컴터로 해야할 게임을 폰겜으로 출시한거...번역도 더빙대사 그대로 박아놓은거같고 최적화가 암만좋아도 최신폰아니면 중간옵에서도 이펙트 터지는데서 버벅거림
3,적절한 점수 3점
5,정말 재밌게 플레이하고 있습니다.!! 사람들은 호불호가 갈린다고 하고 막히는 부분이 있네 과금을 해야되네 그러는데 재미만 있으면 무슨 상관입니까? 재밌습니다 따봉 드세요
1,분명 오래할만한 게임인데 bm에서 불쾌한 게 있음 일단 재화 많이 주는 거 같아보이지만 막상 뽑기창 들어가면 5000개 요구해서 가챠할려면 하루종일 모아야하는데 오픈 초기니까 괜찮아 보여도 이제 광산 다 파먹으면 수급처가 이제 사라져버리는데 과연 이게 패스로 이벤트로 충분할지 의문임 심지어 무기 가챠는 픽업 무기가 나올 확률이 25%인데 꽝일 확률은 75% ㅋㅋㅋㅋㅋ 진짜 처음 봄 물론 6성 확률이 4%인걸 감안해도 사실상 운 안 좋으면 천장쳐서 뽑으라는건데 결국 한 버전동안 쌓이는 재화가 어느 정도인지는 좀 지나봐야 알겠지만 별로임
2,"그래픽, 캐 디자인&모델링은 매우 훌륭하나 전투 재미없고 타격감이 약하고 타겜에 비해 BM 비싸고 재화수급량 적음. 👎"
1,스토리를 보기위해 전투를 하는건데 스토리가 재미없고 전투를 하기위해 공장을 하는건데 전투가 재미없고 공장은 할만함 최적화 매우 잘되있음 그것만으론 플레이 동기가 생기지않음 적어도 캐빨이라도 할라했더니 남캐 여캐 퍼리 전부 같은 가챠풀에서 뽑아야하고 취향의 스펙트럼을 너무 넓게 잡은듯 과금 할 맛도 안남
1,전투를 하고싶은데 스토리가 대부분 기계 뭐 하는거라서 좀 별로임.
5,아니 평점이 3.2??? 이정도로 평점이 낮다고? 물론 공장이라던가 스토리라던가 재미없거나 보완해야할 부분이 많지만 이겜 정식출시 된지 1달도 안됐어요 님들아;; 공장이나 이런건 호불호 많이 갈릴거라 생각하긴했는데 아무리 그래도 절대 3점대 겜은 아님 취향 잘타면 공장 짓는것도 재밌고 맵돌아다니면서 아이템 찾는맛이 꼭 예전 젤다하던 느낌도 났었음 물론 스토리나 전투적으로 보완해야하긴 하지만 취향잘타면 재밌습니다 찍먹추천
2,당신이 직장인 이라면 할게 부담될 정도로 많습니다. 평소에도 할게 없다. 정신 부여잡고 노가다할 게임이 필요하다. 당장 시작하세요.
1,80뽑에 명함만 따서 튀고 싶은데 강제로 무기 뽑아야 함. 120연차를 못하면 픽업 진입조차 못하고(120연 천장 날라감 이슈) 강제로 쉼 청년 해야 함. 그나마 주는 가챠권은 로테 지나면 사라짐. 맵에 상자가 ㅈㄴ게 많은데 가치는 또 낮아서 효율도 구림. 대략 4픽업마다 1천장 칠 수 있음. 유저가 가챠 하고 싶으면 하는게 아니라 계산해가면서 고민해야 함. JOAT
5,재미는 있는데 bm 개선 좀 합니다
5,공장 반픈인데 원신라이크로 오해받았던 느낌? 그래픽이랑 최적화 굿. 고칠점이라면 전선 좀 늘려주고 bm최적화 필요할듯
1,"런칭 전 공방에서 해묘가 얘기한 바와 꽤 다른 게임. 혜택 많이 주는듯 했으나 자세히 알아보면 다른 게임에 비해 가챠시스템이 굉장히 구린 편. 악마적인 BM이고, 천장 이월도 안 됨. 공업 시스템도 부담없는 부적인 콘텐츠인것처럼 이야기했으나 게임의 본체가 공업임. 근데 그 공업은 진짜 복잡하고 튜토리얼 고봉밥에 편의성은 1도 없음. 팩토리오 좋아하던 분들은 잘하겠으나, 캐릭터 때깔 보고 온 일반 섭컬겜 유저들은 다 도망가게 되는 불편한 게임임. 인방 광고에서는 공업 하나 제대로 안 보여주더니 이유가 있었음 ㅋㅋㅋ 게임이 아니라 노가다 뛰는 기분이라 스트레스가 오히려 쌓임"
2,과금 유도 굉장히 심함 픽업 어렵게 말 길게 해서 사람들 착각하게 만들려는 중 혓바닥이 너무 길어 공장 게임을 만들고 싶었는데 투자한 돈이 아까워서 과금 모델을 억지로 쑤셔 넣은 느낌 출시 할인 행사도 없음
4,튜토랑 공장 어느정도 다 지으면 그때부터 할만해짐 근데 그 전이 너무 개노잼이라 대부분 사람들 접힐듯
5,이제 갓나온 게임입니다 지금도 훌륭하지만 더나아질일만 남았습니다
5,재밌네요
5,"공장초반에 머리아픈건 맞는데 적응하면 나름 매력있음. 최적화 좋고 게임성 괜찮음, 여캐 이쁨."
1,다 괜찮은데 공장시스템이 너무 빡세다+가챠.
5,더 아방가르드한 게임 공장 개재밌네 ㅋㅋ
1,일하고 와서 또 일시키네
5,최적화 좋고 그래픽 훌륭함
5,아방가르드
1,게임사가 무엇을 하고 싶은건지 잘 모르겠는 게임
5,공장 시스템이 처음에는 복잡하긴하지만 이해하면 쉽고 재화도 맵에 있는 상자로 많이 모을 수 있음
1,쓰레기 같은 게임
5,재미있어요 오픈월드이며 공장 짓는 게 아주 좋아요^^ 다만 무릉 진입하고 시간이 지나자 렉이 발생하는 것 같은데 주의하세요^^
1,그냥 명조나 젠존제 하세요
5,레바테인 내 아내임 ㅇㅇ
1,의미없는 설문조사 개선하지 않는다면 필요없다
5,"이겜은 가챠맛으로하는게 아니라캐릭터들 캐미보는맛이라 보면 편함 천우,펠리카,여자관리자 요 셋 너무귀여움ㅋㅋㅋ"
5,모바일로하기엔 헤비하지만 취향만 맞으면 대체 불가임
5,남들하고 경쟁하는 컨텐츠가 없는데 맘이 급한사람은 재미 없을 듯한 게임 ㅋㅋ 천천히 하나하나 공장 뜯어먹고 필드 뜯어먹고 스토리 뜯어먹고 캐릭터 디자인 등 꼭꼭 씹어먹으면서 하면 하나의 스팀게임을 무료로 하는 느낌임 현재 본인은 6성 캐릭 없는 파티로도 잘 깨는 중 ㅇㅇ 리세마라 할 필요도 없음
5,뭐...알잘
1,왜 스토리 스킵안됨..? 대체 시작부터 강제로 몇 개나 보여주는거임? 왜 그러는거임?
1,"뚝심을 밀어 붙인 결과 호불호를 겪는다. 전반적으로 느낀건 게임이 굉장히 노동같이 만들어졌다. 캐주얼하지 않다. 한번 실행하면 오랫동안 플레이하고, 자주 들어오도록 유도했다. 그게 부담스럽다. 오픈 필드는 그냥 유행이라 넣은 느낌."
5,"원신+데스 스트랜딩+새티스팩토리+명일방주 원신 외엔 하나같이 호불호가 극명하게 갈리는 장르들인 만큼 이 게임도 극호와 극불호로 나뉘고 있다. 한번만 지긋하게 잡숴봐. 나도 이전까진 공장 시뮬레이션 게임들 대체 뭔 재미로 하나 했는데, 이 게임 때문에 전봇대 하나 컨베이어 벨트 하나에 황홀경을 느끼는 공장박이가 되어버림. 전(선)손실 안 나게 조심하고."
5,"매일 10분 딸깍하고 끝나는 할거 없는 게임만하다, 제대로 시간 박아넣을수 있는 게임이 나와서 재밌게 하고 있습니다. 초심 잃지 마시길"
5,아니 이 폰 유저들은 찡찡이 밖에 없음? 애초에 컴이 메인이고 폰이 서브임. 컴은 120프레임 지원에다가 최적화 잘 되라고 엔비디아 DLSS까지 호환되게 만들었음. 근데 렉걸린다 버벅인다 하는 놈들은 이거라고 봄. 컴이 구리거나 엔비디아 글카 업뎃을 못해서 DLSS설정을 못하는 경우. 그리고 애초에 이 이게임 출시 권장사양 높은 편에 속한다. 그리고 하나 더 열 받는건 공장 시스템 난 좋게 봄. 이게 어렵다 생각하는 놈들은 대가리가 없음? 그냥 자기가 이런 머리 쓰는 공장 시스템을 못 따라가겠으면 시뮬레이션 돌려서 청사진 얻고 그걸 가져다 쓰셈. 아니면 유저들이 더욱 효율적이게 만든 청사진도 많으니까 제발 좀 손가락이 있으면 검색을 하고 찾아봐. 그리고 전투 조작법 운운하는 놈들 많은데 전투 시스템이 특이한 것도 맞고 불편한 것도 맞음. 근데 불편한건 폰유저가 하기에 불편한건 이해하는데 컴유저가 어렵다 하는건 무슨 경우냐? 시스템으로만 보면 원신이 더 어려워 이것들아.(난 51렙임)
2,1장 스토리 넘 재미없음 인게임 승급재화도 하나하나 가서 캐야되는거? 진짜 열받음
5,호불호심히 갈림 공장컨텐츠와 캐릭터 디자인이 맘에듬
5,제 인생게임 등극...공장도 하다보니 너무 재밌네요
1,장점-최적화가 좋음 단점-강제로 시키는 공장이 너무 짜증남 메인스토리중간에 공장을 자꾸 시킴 이 게임엔 스토리라고 부를게 없슴 공장튜토를 위한 발판만 존재함 bm이 미치도록 비쌈 서브컬처중 탑인듯
1,기대하는데 3년 실망하는데 1일...
1,BM 뽑기 매움
5,후속조치믿어요
5,공장은 청사진 쓰고 10초정도만 생각해도 쉽게 가동이 가능함 가동 방법이 이해 안가는 것도 역순 잠깐 생각해보면 답 금방 나옴 좀 더 공장 기능을 더 넣어줘도 좋을듯
5,존잼
1,"이 게임은 기존의 공장겜들이 얼마나 잘만든겜이였는지 깨닳게해줌. 공장진행에 미친듯이 발목잡는 스토리. 애매한타격감의 전투. 공장도 있는데 쓸데없이 왔다갔다해야하는 제강호의 파견시스템. 전선을 온사방에 깔지않으면 써먹질못하는 짚라인,포탑 이게임의 목적이 뭔지를 모르겠다. 공장을 굴리게하고싶었다면 다른부분이 가버워야하는데 무거운 스토리. 무겁고 둔탁한 전투. 무거운 일일숙제. 매일매일 캐러다니는 희귀광물등등 한달정돈 어떻게 변하나 보면서 해볼생각인데 그동안 어떤 목적을 못찾으면 미련없이 접겠음. 그리고 스트리머 광고 엄청하던데 그딴거에 쓸돈있으면 편의성 개선같은데에 더 투자해라."
5,시간살살녹네
5,디테일에만 힘을 잔뜩 주면 일어나는 일을 집합한 게임 엔드필드 내 컨텐츠들이 기존 다른 오픈월드 게임과 비교하면 굉장히 아방가르드 한 점이 튀는 모습이 많다 물론 이 기존의 틀을 벗어나는 모습이 새로운 경험을 주는것도 있지만 결국 이런 경험을 겪기까지의 과정이 불쾌할정도로 불편하고 재미없는 과정이 되어버린것이 매우 큰 요소로 작용했다 큰 재미를 느낄만한 부분이 아직은 적고 개선할점이 많이 나온것은 사실이나... 우리 게임 나름 맛있어요... 디테일하게 만족할만한 요소들이 숨어있어서 그렇지 기깔나요...
5,공장은 고인물 공장장분들의 청사진으로 알차게 활용중입니다. 감사합니다. 자고일어나도 알아서 창고가득 템 파밍이 된다니까!!!!!!
5,머리쓰는거 좋아해서 쥰내 재밌게 하는중
5,호불호 갈릴만한데 호면은 대체할 겜 없는듯
5,"관리자 51렙 찍고 쓰는 후기인데 수영,벽타기 안되는 부분 제발 약식이라도 추가해주라 너무 답답함.. BM 부분은 가챠구조가 복잡한 순간부터 실패한 BM 같은데 1.0버전 월정액 기준 190뽑쯤 나오고 돌파 효율 낮은편이라 패키지랑 사료량 지켜봐야 할 듯 PC 최적화 및 그래픽은 최상위권 맞음 박아둔 게임 패드로 무릉부터 해봤는데 놀랐었음 그리고 공장 시스템<< 이게 특유의 복잡함이 있음 청사진도 결국 구조를 이해는 해야 대충 굴릴 수가 있어서 확실하게 호불호 갈릴 것 같긴 함 근데 한번 해두면 자동화라 크게 귀찮지는 않았음 게임 애매하면 무릉까지 해보고 접던가 하면 될 듯"
4,"대규모로 광고했으니 뉴비 대거 유입됐을 거고, 호불호 많이 갈리는 겜이기 때문에 평점 박은건 어쩔 수 없음. 다만 인게임 내 불편한 요소들, 복잡하고 매운 bm시스템 등등 개선사항이 많고 서서히 고쳐나가야 할 것들이 실제로 다수 존재(번역찐빠 등등) 그러나 여지껏 다른 서브컬쳐 게임들의 정출 시의 버전 퀄리티를 생각한다면 엔드필드의 최적화 등등은 정말 끝내줌.. 개선사항 서서히 고쳐나간다면 순항궤도에 들 것이라고 생각함."
5,호불호를 탄다고는 하는데 내 기준 공장 시스템은 정말 쾌적하고 재밌었음 다른 공장게임에서 복잡한 요소는 덜고 적당히 몰입할 수 있게끔 만들었으며 전투는 스킬만 읽고 연계를 이어가면 적당히 한 웨이브 15초 내로 처리 가능함 Bm 비싼건 서브컬처 게임들 초기에 다 겪는거니 어쩔 수 없이 감내해야한다 생각함. Bm이 비싸다기보다는 수급처가 부족한 느낌? 하지만 스토리 노잼인건 명확한 단점 그냥 스킵때리고 맵탐방/공장 짓는 맛에 하시면 될거같아요
1,걍 재미가 없음
1,재미는 있는데 동시에 불쾌한 게임
5,이게 공짜라니
5,스토리가 지루하긴함 공장은 호불호 갈리긴하던데 나는 호였음 그리고 오픈월드인 것치고 맵이 넓진 않은데 꽉 차있어서 오히려 좋았음 bm은 조금 매운 느낌이 있긴한데 그래도 할만하다 봄 최적화 goat
5,굳
5,나한테는 재밌으니까 됐어
1,회사 퇴근해서 게임을 켰더니 다시 회사 출근시키는 게임.
1,에픽퀘스트 깨다가 '앞길 개척'에서 막혀서 젠장 어떻게하는지도 모르겠고 유튜브 봐도 모르겠고 걍 접음.
5,공장 하다보니 생각보다 재밌긴함 애초에 공장겜이랑 안맞으면 어쩔수없고... 청사진으로 복붙이 되서 공장 시스템만 알면 직접 하나하나 지을 필요도 없어서 생각보다 편했음
1,"요약 : 비교되는 다른 게임들에 비해 특출난게 재밌는 부분이 크게 없는것 같네요. 1.전투가 재밌는가? 명조보다 별로였습니다. 아니 다른 오픈월드 서브컬쳐와 비교해도 특출난 부분 없는 그냥 평범한 전투 느낌이였습니다. 2.그래픽이 예쁜가? 그래픽은 잘 뽑긴 했는데 모바일로는 발열, 성능 때문에 타협해야해서 장점인진 잘 모르겠네요 pc면 장점이 확실할 것 같네요. 3. 공장 시스템이 다른 단점을 씹어 먹을만큼 재밌거나 특출난가? 호불호 많이 갈리는 시스템을 넣었는데 딱히 재밌지도 않고 테크트리 뚫고 청사진 얻으려 하는 튜토리얼도 지루하고 오래걸려 저는 불호입니다 4. 개인적 생각 그래도 출시때 흥미가 생겨 리세마라를 5회정도 했습니다 5회 모두 상시 6성캐릭터 확정에서 남캐 떠서 접었습니다 리세하는 9시간동안 강제되는 컷신, 대사등이 몰입에 방해될정도로 불쾌했고 앞으로도 그런 부분 많을꺼라 생각해 깔끔하게 접었습니다"
5,이겜 반응들 보면 세글자 떠오름 '국 평 오'
3,배경설정때문이겠지만 색감이 너무 칙칙해요 ㅜ
5,공.장.좋.아
5,첨엔 별로였는데 하다보니 시간도 잘가고 괜찮은듯
5,전투 진짜 개맛도리임 연계기랑 아츠폭발 시너지 맞춰서 조합 설계하는 재미도 있고
5,공장 싫으면 재미없을 수 있음 난 재밌게하고있다
5,"bm이랑 전투 타격감 개선되면 좋을듯! 무릉지역부터는 건설할때 일일이 전선안연결해도되고 초반버티면 후반엔 공장 하게되더라구요..나 공장게임 잘맞나봐🥹 요즘 게임들 딸깍,일퀘하면 할거없었는데 병목해서 하니까 좋네요!"
1,공장은 재미도 없고 노골적으로 과금 유도 하면서 재화는 주는 것도 없고 전투 타격감은 솔직히 원신보다 별로인 듯 굳이 할 필요 없는 겜 같음
1,어우 좀 매워요...
5,호불호가 강할지언정 진심 잘만듬 진입장벽이 워낙크긴한데 그 벽만넘으면 우상향 루트타면서 무릉때 고점찍음 근데 시간 적은사람은 하기 힘들긴할듯
5,남들은 욕하는데 난 펙토리오랑 명방 둘다 했던 사람이라 재밌더라
5,공장겜 재밌어요~^^ 모델링도 좋고요 퍼즐요소도 좋네요 뽑기시스템이 많이 빡시긴한데 글도 좋습니다
5,Gud
5,공장꿀잼
5,꽤 재밌는듯 밤새 하고있음
5,"취향 호불호는 갈려도 이걸 평을 안좋게 주는건 게임 평론가 놈들과 다를 바 없다. bm비싼부분도 있으나 캐릭터는 기본지급 캐릭터로도 충분히 원활한 진행이 가능하며 강제성이 낮아 과하다 보기 어려움 게임 자체는 최고수준의 최적화,맵디자인 그리고 공업등의 서브컨덴츠와 어우러지는 깔끔한 레벨디자인 비슷한류의 게임들의 온갖 불쾌한 요소들을 라이트하게 경량화 했으나 파고들 요소는 분명히 있는 깊이가 있는 게임 플레이 타임이 장르특성상 길으니 시간 좀 여유되는 사람은 강추"
1,게임이아니라 일을하는느낌
4,확실히 호불호 갈릴듯 나는 공장 시스템 생각보다 재미있는데 안맞는 사람은 지루하다고 느낄듯 그리고 가챠 재화 수급이 너무 적음 도대체 언제 10뽑 모이는 거임?
5,난 재밌다
5,재미있는 게임 입니다
5,다퍼먹었는데 이제 뭐함? 공 장 최 적 화
5,"인생겜. 몇몇분들에겐 게임 시스템이 어렵고 주위의 서브컬처겜이랑 다름 부분이 많아 적응이 어려울지도 모르지만, 이런 특색이 이겜만의 특징이고 익숙해지면 이런 독창적인 겜 찾기도 힘들어용~좀만 참아보면서 햐보면 재밌을것 같아요"
5,재민노
5,난 너무 좋은디 공장 싫다해도 1점은 너무하네 다들
3,"대체 왜 이 오픈월드 서브컬쳐 게임에 공장 시스템을 넣을 생각을 한건지 의문이네요. 출시일부터 약 일주일 가깝게 해본결과, 게임에 흥미가 붙을지언정 오히려 시간이 지날수록 흥미가 떨어져 갑니다.. 공장시스템은 물론이고 BM가챠 꼬라지에다가 10회 뽑에 들어가는 재화를 생각하면 감히 함부로 돈을 지를 수가 없더라구요.. 결국엔 10회 뽑을 하려면 임무를 해야되는데 이 임무를 통한 보상도 대체로 너무 적습니다.. 와중에 컷신은 더럽게 많아서.. 그나마 재미있는 메인 스토리를 민다고 하더라도 결국 공장 부분에서 막히게 됩니다.. 진짜 공장 시스템은 할말하않입니다.. 허나 이렇다 하더라도 공장시스템이 사라질리는 없겠죠? 실상 이 게임의 메인요소인듯해서.. 아님 유저들 빠져나가기 전에 개편좀 해주세요.. 생각해보니까 이런 공장 요소는 막상 광고로는 1도 안나왔던 거 같은데.... 해묘해묘야.. 우릴 속인거니..?"
5,사람들이 일하는 기분이라해서 의심 반으로 깔았는데 매우 재미있게 플레이했음. 이게 약간 스팀겜 중에 아크나 팰월드같은거 좋아하는 사람은 재밌게 할것같음.
5,다좋은데 BM무겁다는건 거지새끼들인가?
5,장점 : 모바일의 범주를 넘어선 게임 단점 : 모바일의 범주를 넘어선 게임
1,모바일 최적화 개판임 이게 폰으로 하라고 만든거냐?
1,공장겜 할거면 차라리 팩토리오를 하러갔지 게임 자체가 재미가 너무 없음
1,태블랏 게임패드 좀 업댓해줘요 샤오미미니프로 쓰는데 게임패드 연결해도 xyab가 인식이 안되는개 말이되요??? 다른게임은 다 잘됨
1,개지루해ㅠ 뽑기도 거지같고..타격감도 딱히 있지도않고-.-;;딜이 딱히 나오는것도 아니고-.-;; 전력연결은 또 무슨 귀찮은 컨셉인지-.-;;; 그냥 예전겜들 하는게 더 나을듯-.-;;; 개노잼-.-;;
5,캐릭이 존내 이쁨
1,쓰레기
5,맵돌아다니는 재미 공장재미 전투도 연계시스템 이정도면 재미져서 호불호갈릴거같은데 개인적으로는 넘 재미짐
1,공장건설 게임
5,폰으로는 힘들고 플스로는 할만하네요
5,너무재밌서요
5,콘솔 aaa게임과 비교해도 손색이 없는 잘만든 겜
5,명방팬유저로서 할만했움. 이상하게 바이럴되서 너무 기대감가지고하는사람들이 많은듯. 걍 적당히 기대없이하니 할만한듯
4,"모바일게임보다는 진득히 오래 잡고 하는 콘솔 패키지 게임의 특징이 더 짙은 게임입니다. 전작 유저이기도하고 공장과 탐험이 취향에 맞아서 재밌게 하는 중이라 4점을 주지만, 앞으로 서비스해가며 개편해야할 점이 많습니다. 1장 스토리는 매력이 굉장히 떨어지며, BM은 그렇게 저렴하지 않고, 유저로 하여금 불쾌한 감정을 들게합니다. 인게임에서도 편의성 설계나 전투 레벨링 등 아쉬운 점이 많습니다. 그럼에도 공장+전략RPG라는 새로운 시도를 하는 도전정신과 게임의 잠재력은 높이 평가하는 게임입니다. 앞으로 좀 더 지켜보겠습니다."
2,"한 삼사일간 잠도 못자고 재미있게 했는데, 일단 완상도 면에서는 너무 잘 만든 게임이라고 생각합니다. 다만 게임을 즐기는 유저 입장에서는 단점이 많네요. 시스템이 너무 복잡해서 그거 이해하고 따라가는 것도 벅찬데 세계관 스토리까지 보기도 힘든데 대화가 너무 많아서 다 넘기게 되고 누적될수록 무슨 스토리를 하고 있는지도 이해하기 어렵고, 그리고 직장인으로서는 게임을 즐기는 하루 시간이 다들 짧은데 이 게임은 엄청난 플레이 시간이 필요합니다. 그 와중에 대화나 영상 같은 소모되는 요소들이 너무 많아요. 그리고 격투 시스템은 취향이 사람마다 다르겠지만 뭔가 좀 부족합니다. 캐릭터별로 스킬이 하나랑 궁극기 하나 밖에 없어요. 나머지는 다 평타로 싸워야되는데 평타도 느리고 뭔가 타격감이나 이런 재미 요소가 없다고 느껴집니다. 삭제한 궁극적인 이유는 과금 시스템 때문입니다. 캐릭터 얻기 확률이 0.6% 극악 난인도인 반면에 돌파요소로 인해서 이걸 풀로 얻으려면 얼마나 걸릴지 가늠조차 안됩니"
1,재미없음
2,공장이 주력이고 액션은 장식
5,공장 업무가 좀 부담스럽지만 청사진 공유기능이 있어서 딸깍하면 되고 명방 본가도 그렇고 꾸준히만 하면 무과금도 따라잡을 수 있어서 좋은 게임이라고 생각함
5,이런 공장 만드는 게임 처음인데 잘맞는것같고 전투는 뭔가 뭔가인 부분이 있는데 그래도 그럭저럭 괜찮은편인것 같음 그리고 육성은 조금 힘들지만 캐릭터가 이쁘고 멋있고 맛있음
1,과금 비엠 너무 매움. 페그오나 하러 갈게요
5,최고임
1,그냥 재미없음
1,정식출시시 무료135뽑 헤드헌팅 즉시 수령이라면서????? 도대체 언제줍니까??? 그리고 게임이 공장노가다를 적당히 시켜야지 ??내가 게임을 하려고 왔지.게임 세계에서도 일을하고 싶겠냐???그래...건축과 나온거는 알겠는데 게임이 너~~무 노가다야!!!!. 퀘스트 한번하는데 전선이어주고 전력 끌어오고 퀘스트 단서나 상자는 이상한데 짱박아놓고 그거 구하라고 하면서 또 전기 끌어와서 연결해야 스위치 올려서 문열게 강제하고 ㅋㅋㅋㅋ 그냥 문열어줘. 기믹질하지말고 그리고 그냥 채집이나 파밍으로 끝내야지. 무슨 물약 만드는 기계까지 유져들이 만들게하냐??? 힘들게 얻은 캐릭터로 전투 할 일도 거의없음 . 게임에서도 일을 시키니 다 나가떨어지고 거품이라고 욕먹지....공장시스템 이 뉴비절단기수준임. 전투를 할 일이 거의 없으니까 뽑기도 할 필요성을 못느낌. 공장 시스템은 제발 뜯어고치길. 청사진이고 뭐고간에 공장 시뮬레이션 하는데 시간 다 잡아먹음.
5,공장을 더 추가해주십시오
1,어느부분 하나 뛰어난게 없이 딱 그 정도의 재미만 보장하고 뛰어난 부분이 그래픽말고는 없다. 게이머들은 왔다갔다 반복적인 노동을 싫어한다. 부엉이도 그렇고 재료파밍도 그렇고 왜 저정도의 문명에 심지어 공장게임인데 자동화랑 편의성이 제공되지 못하는부분이 이리도 많은지 모르겠다. 스토리는 그냥 올스킵때리는게 더 재밌을정도로 깊이도없고 의미도 없다.
4,모바일겜이 아닌 콘솔겜으로 즐기면좋습니다. 문명이후 즐기는 타임머신겜 다만 bm좀 더 싸게해줫으면합니다.
5,취향맞으면 정신없이 할수있음
5,게임이 재밌고 캐릭터도 예쁘고 잘생겼어요
3,"공장컨텐츠는 재미있음 BM 비쌈 필드 잡몹, 퀘스트진행시 몹들 피통 너무단단함 전투가 피곤함"
5,악질 별점떨구기 분탕세력분들 제발 나가세요~
5,진입장벽 높지만 빠지면 재밌는 게임
5,취향 맞으면 재밌긴함
1,똑같은 중국 겜 무조건 천장 찍어야 하는데 무기뽑기까지 있음
5,난 맛있는데?
5,완전최고
