score,content
4,"개인적인 평가를 정리해봄. 주관적이며 전문가 평가도 아님. 1. 스토리 / ★★★☆ 4번협곡은 정말 지루하고 별 내용도 없지만 탄탄한 세계관과, 벌써부터 조금씩 보이는 연출의 고점을 보면 같은 명씨 모 게임처럼 초반 스토리 말아먹어도 어떻게든 기대를 충족시켜줄거란 기대감이듬. 2. 전투 / ★★★★ 전투 시스템도 무난하게 잘 짜여있고, 물리덱등 보는맛, 타격감이 출중한 파티나 레바테인덱 같은 하이퍼캐리 파티로 딜뽕을 느낄수도 있었음. 근데 잡몹의 체력이나, 조작의 편의성등 더 수정할 여지는 남아있는듯 3. 공장 / ★★★★☆ 공장겜의 복잡성이나 의도적인 불편함은 가능한 배제하려한게 느껴짐. 그럼에도 진입장벽이 높다는 사람도 있지만, 공장게임을 적당히 즐기는 나같은 유저에겐 딱 적당한듯. 오히려 고인물들에게는 부족할것 같음. 4. BM / ★★★ 명전만 보면 그리 비싸진 않은 BM. 하지만 단순 명전이 아니라 이월이나 천장등 혜택까지 고려하면 문제는 많은듯"
5,엔필 광고 그만해라
5,그냥 유료를 무료로 즐길수 있는 고퀄 콘솔갓겜;;
1,처음시작> 1시간20분동안 영상봐야함 그러면 레벨5?ㄴㄴ 겨우3 ㅋㅋ (이거 끝나야 닉네임생성가능^^) 레벨1업할때마다 건너뛰기 안되는구간 영상 전부봐야함. (지금까지 이런게임 처음봄) 레벨10 > 끈기?체력?ㄴㄴ 재미있다?ㄴㄴ 캐바캐?ㄴㄴ 폰 좋은데 옵션 매우낮음해두고 플레이해도 한번씩팅깁니다. 이틀동안 몇시간씩투자 해서 결국 10찍고.. 이제 12찍었는데 퀘스트 설명<< 불친절함..매우! 응? 이게아닌가? 어라..뭐지 << 100%공감 하시는분들 👍 좋아요눌러주세요.^^7 결국12 이꽉깨물고 뭐가달라지는지 찍어본결과 아무것도 없었다. ^^ 대뜸 마을주변에 (위험요소처치)시공간의틈 같은게 있는데 << 겁나쌤ㅋㅋ 그냥 필드몹.. 보스아님 다 때려잡아봤지만. 그냥 별거없는수준^^ 모든게 밸런스부터 웃기는수준입니다. 이걸잡아야. 그만한가치의보상이있는가보네? 카악퉤.. 아무것도없습니다.
5,이게.인생겜이다
5,스토리개인적생각으로는 괜찮음 근대 모바일로 컨트롤러조작이 조금이상함 나만그런 걸수있슴 그래도 나는 재미있슴
1,지루함
2,캐릭터는 이쁜데 그 외에 여러가지가 좀 별로다. 스토리는 그냥 너무 평탄하게 흘러가서 재미있는지 모르겠고 제일 중요한건 공장이 너무 재미가 없고 스트레스만 쌓인다. 캐릭터라도 이뻐서 2점 드립니다.
5,이겜은 원신같은 오픈월드겜을 생각하면 안되고 아스트로니어같은 공장겜을 좋아하면 한번쯤 권해볼수있는 겜 난 개인적으로 재미있음
1,최악
3,"게임은 잘 만들었는데 광고랑 너무 다르다. 가챠 있는 패키지 공장게임이라 생각해야 함. 왜 액션겜으로 광고한걸까... 공장겜 취향이 아니고, 한 3년차 가서 지역 10개쯤 되면 공장 너무 머리아플 것 같아서 놓음.."
5,공장 시스템이 재밌지만 현재 작동중인 공장을 갈아엎거나 수정하는게 불편하다고 생각됩니다. 세이브 파일 같은걸 만들어서 원래 공장은 남겨두고 다른 파일에서 작업할 수 있게 하고 설령 그 파일에서 만들던 게 실패하더라도 원래 공장의 세이브 파일을 통해 복구가 가능할 수 있으면 좋겠습니다. 청사진으로는 크기가 제한되어 있어서 이러한 세이브 파일을 구현하기는 힘들다고 생각합니다. 그리고 합류기가 제 역할을 못하는 것 같습니다. 세 방향에서 컨베이어가 합류하는데 나가는 건 한 방향이라서 물류가 쌓입니다. 다른 구간은 아니더라도 적어도 합류기에서만큼은 컨베이어 속도가 좀 빨라졌으면 합니다.
5,나름 재밌는데 무릉 뚫고 전력 정상화하니깐 할게없어지는... 무릉 신규 개척지 언제 뚫리나요?
5,원래 명방 세계관에 관심이 많고 템포를 느긋하게 가져가면서 공장에 거부감이 없는 분들에게만 추천
5,배신하러가야하는데 너무 재밌다......
5,다좋은데 서브퀘랑 튜토 난이도는 좀 낮춰야할듯 물총쏘기퀘 10퍼 채우고 20-30퍼 떨구고 반복하는거 애바임
5,"솔찍히 그냥 가볍게 할려는 사람들은 안맞을듯..공장이 쥰나게 빡세가지고 근데 공장겜을 좋아하거나 만드는거 좋아하는 사람들은 좋아할듯,전투도 솔찍히는 낫 배드긴 한데 막 명조 원신처럼 전투가 쩌는건 아니고 그냥 젤다 전투처럼 무난한 느낌 좋아하면 잘맞을듯 아마.."
5,꽤 재밌지만 할게 너무 많음 마치 고봉밥을 물 없이 퍼먹는 기분
5,해보니까 상당히 재밌네요 ㅎㅎ
5,Not bad
5,취향만 맞으면 콘솔게임마냥 시간 갈려나가는 게임 우선 모바일게임마냥 가볍게는 절대 못함
5,"이동수단 필요하오 어서 오토바이나, 비행선이든 공중 뜨게하는 아츠든 추기해주시오 너무 힘들다오"
5,서브컬쳐의 지친 나에게 카페인을 강제로 먹이는 게임
5,취향을 많이탈꺼같은데 잘맞으면 재밌음
5,정말재미있게 하고 있어요
5,God dem 이gun 이번year 최고의 goat 게임 이다
1,"게임 외관은 잘 만들었음 이쁜 캐릭터 디자인과 넘사벽급 최적화,연출,더빙,컷씬까지 다 업계에서 최상위권인건 팩트임 근데 문제는 너무 많고 귀찮은 숙제들과 무소과금들은 하기 싫어지는 BM, 또 전작 안해본 사람들은 알아먹기 어려운 전문용어와 너무 많은 고유명사 및 구구절절 설명들이 정말 큰 문제임 솔직히 게임 점수로만 본다면 1점은 아니지만 위 문제들이 빠른 시일내에 해결되길 바라는 마음으로 1점 줬음"
3,장점: 최적화 고트 단점: 할게많아서 시간이 많이 필요함 힘듬
1,시간낭비
1,BM이 진짜 맵다 보스 패턴 가시성이 엄청떨어진다
1,아직 게임시작도못하고 리뷰남기로 오긴 첨이네 게임들어가서 30분째 영상만보다겨우 캐릭명만들었는데 아직도 영상만보고있다..스킵이전혀없어
5,너무재밋어요
5,취향맞으면 하루 10시간 쌉가능 컨텐츠볼륨이 모바일수준이 아님.. 모바일 최적화가 외계인 고문한 수준
5,취향맞으면 진짜 재밌음
5,정말감사합님담욤^^사랑합님담욤
5,비록 수르트 풀잠에 내 지갑이 광광 우렀지만 아방가르드하시잖아~ 한잔해~
5,공장 더 추가 좀
5,갓겜 억까 ㄴㄴㄴㄴ 해묘의 큰 뜻을 알라
1,진짜 공업 컨텐츠 누가만들었냐 쓸데없이 할거 너무많네
1,진짜재미없다
5,이게 게임이지
5,"공업이 어려우면 배워 찡찡대지말고 나 무과금인데 레바테인 뽑았어 그리고 여러모로 과금않하고도 보상이 많아서 다른 게임보다는 좋아 자꾸만 어렵다 뭐하다 온갖 핑계대면서 않할거면 공부라도해 싫으면 잘가시고, 엔드필드 앞으로도 난 잘 할 테니깐 명일방주 엔드필드 응원해"
4,다 좋은데 공장이 너무 벽임;;시간을 너무 쏳다 부어야함
4,게임 정말 잘만들었는데 공장은 내 취향이 아님
5,"오픈부터 지금까지 하루에 거의 10시간씩 해봤는데 다른사람들 하는거 보면서 알게된게 이겜은 출시된지 얼마 안된 지금 시점의 리뷰로는 판단이 불가능 하다는거 몇일 해보고 할만하다 싶으면 하는거고 별로다 싶으면 그냥 안하면 되는 게임임 그리고 캐릭터 뽑지도 못한다 이러는 사람들이 있는데 한정 캐릭터,전용무기를 무과금으로도 충분히 뽑는게 가능함(일상,노드,이벤트등) 거기다 초반(빨리하면 기대시간이 1시간정도)에 무료로 확정 6성(상시) 뽑을 수 있음(리세 가능) 그리고 스토리 부분에서는 4번협곡만 하다가 폐사한 사람들이 많으니까 리뷰 걸러 듣기를 바람 일단 4번 협곡은 엄청 긴 튜토리얼(인데 스토리도 정보를 때려박는 느낌)이라고 생각하면됨 물론 나는 탐험하면서 전선 깔고 공장 돌리는데 필요한 광맥 찾는게 재밌어서 맵 전부 파먹긴 했는데 싫어할 사람이 많을 느낌임 그나마 나은게 캐릭터 스토리는 평타 이상이라는거 그 다음 지역이 무릉인데 여기는 아직 미는 중이라 나중에 리뷰 수정함"
1,아 무슨 용량을 20G가 넘게 잡아먹지 급삭제합니다
5,재밌게 하고있음
5,정말 재밌습니다
4,취향에 안맞다면 최악의 게임 반대로 취향에 맞다면 대체 불가한 게임 미소녀 오픈월드에 공장이 결합됨으로 인해 부족한 부분인 전투와 스토리를 상쇠할정도의 긍정적인 유니크함을 보여줌 허나 취향에 맞지 읺으면 그냥 루즈한 전투와 애매한 스토리+피곤한 시스템을 가진 게임이 됨
1,공장은 ... 너무하자나 그냥 시간많은 유저들만 하라고 만든 특히나 유투버들
1,최적화 했다매요 그대로자나ㅠ 발열이랑 버벅거림이 너무심함 하다보면 뜨거워서 멈추고 그러고선 튕김 메인스토리를 밀 수가 없어요ㅠ
4,미친 호불호겜
5,맞음 재밋음
5,여기앞.게임.좋다.
5,공장 만들기 재미있어요 :D
4,다 좋은데요.. 거..공장만들기 귀찮소
5,퀘스트 다 민 사람 기준에선 컨텐츠 부족함. 일퀘만 깨고 3일에 한 번씩 희귀광물만 찾아서 돌아다니는 정도
3,캐릭터 퀄은 나름 좋은데.. 뽑기 비용이 너무 비쌈.
3,애매함. 엔필 입문이면 좋은 감정 느끼기 어려울 것 같음
5,"오, 전투, 채집, 공장까지.... 공장요소 들어가서 너무 맛있다"
3,재미는 있는데 사료 없음 bm은 매운편
3,공장게임. 호불호 갈리고 과금 빡셈. 홍보를 잘못한거같다는 생각이 있긴함. 근데 평점이 이정도까지 내려올 게임인가 라고하면 글쎄...?
5,초방 튜토리얼 과정에서 쪼매 답답하고 어려운거 참아내면 리턴이 확실한 완성도 높은 게임
5,"한줄 요약 : 겁나 할거 많아서 좋은데 겁나 할거 많아서 힘듦, 근데 대충 22일 오픈때 부터 2월2일 지금 까지 꾸준히 하는 입장에서 뇌빼고 하는 모바일 게임에 현타왔었는데 오히려 좋았음, 할거 많아서 내가 직접 하나하나 하면서 배워나가는것도 좋았고 탈로스라는 세계에 내 살림 차리는 맛에 하는중, 물론 첨에 게임 하면 할 수록 배울거만 계속 늘어나서 힘들었지만 명방이라는 IP 6년간 접했었고 그냥 게임자체가 맘에 들어서 차근차근 하다보니 그냥 재밌어짐, ""빠른 도파민을 원한다""고 생각하면 이 게임 하면안됨 ""좀 진득하게 빠질만한 게임을 원한다"" 이거 하면 될듯. 플레이 방식은 크게 두 부류로 나눌 수 있는데, ""생산라인 구축+세계탐방""이랑 ""전투"" 인데 먼저 전자는 확실히 공부쪽에 가깝지만 하면 할 수록 성취감 좀 있고, 전투는 레벨 디자인 적절한것 같은데 모바일에서 하기엔 좀 어려웠음 글고 아군 적군 버프 디버프가 첨에 좀 복잡해서 공부가 필요함. 의외로 전투방식은 단순해서 좋음"
1,공장설계 장르를 안좋아한데도 간단하게 넘길수있다고 해서 했는데 메인퀘에서 강재로 계속 시켜서 메인퀘스토리 몰입감만 쳐지고 불쾌감만 남내요 거기다 숙제컨탠츠나 퍼즐마저도 너무 귀찮게 해놓음 취향 맞는분들만 하길
4,"BM - ""복잡""해서 비싸다고 느낌 공장 - 미 ㅡ 묘했음 필드 - 몹 체력이 어중간하게 높음 근데 개체수 많음 일퀘 -이성이 최대로 차있는걸 못봤음"
5,공장 초반 진입 장벽이 있는거는 사실이나 그것만 극복하면 갓겜인거 알게 됩니다. 무과금으로도 충분히 지금까지 나온 스토리 전부 다 즐기고도 남아요.
5,공장겜
5,호불호 많이갈릴듯
5,일어나 관리자 전설깔고 공장 돌리고 무트코인 돌려야지...
1,공장 지으면 폰으로 못한다
4,"리소스 다운로드만 하는데 발열 나는거 보고 바로 데탑으로 옮겼는데 데탑도 발열 심함. 그래픽 낮춰도 발열 안 잡힘. 아시아 서버라서 fps가 기본적으로 좀 있고 종종 튐. 메인, 서브 스토리 논스킵으로 플레이 했음. 스토리 보면서 크게 위화감 못 느낌. 상인 NPC가 파는 물건 사거나 서브 스토리 해야 열리는 구역이 있는데 그런 요소 찾는 건 개인적으로 좋았음. 전투는 브레이크랑 패링할 때가 맛있음. 궁, 스킬로만 싸우면 슴슴함. 궁극기 컷신이 임팩트가 약하다고 생각함. 모션 부드러운 건 탑 급인 듯. 공장 튜토 몰아서 할 때 약간 꺾일 뻔했지만 공장 컨텐츠 정복하니까 재밌음. 다른 소리는 적당한데 훈련장 브금만 겁나 컸음. 가챠는 엄두도 안남. 무과금은 앞으로 나올 신캐들 명함만 뽑아도 말라 비틀어짐. 전용무기는 과금러들의 컨텐츠니까 무과금은 짜치는 공사판 에디션 무기나 써야함. 컨텐츠만 안 떨어지면 오래 할 듯."
1,재미 없습니다.. 자동을 넣었으면 합니다.
5,나한테는 입맛에 딱 맞는 게임
4,가챠 때문에 1점 깎았어요 과금하는 이유가 없습니다;; 다만 공장 관련해서 다들 머리 아파하는데 저는 그냥 적당히 여유롭게 돌리니까 재밌는 것 같습니다 너무 ... 효율적으로? 빡세게? 하려고ㅠ하면 힘듭니다 그냥 즐겜하세요... 게임하는데 뭐 그렇게 힘들게 합니까...
1,다른 서브컬쳐 겜도 오랫동안 일퀘하다 보면 일처럼 느껴질 때가 있는데 튜토부터 '아 이건 접어두자' 라고 생각할 정도로 일하는 것 같고 너무 길다.
5,"호불호가 갈릴뿐 누군가는 수집,공장,발전 이것만 있어도 재밌을수 있는거고 누군 아닐수도 있는거임 그리고 모바일로하면 폰으로 냉동밥 데워먹을수 있으니깐 컴으로 하는게 좋을꺼임"
1,게임 스토리는 재미있지만 컴퓨터로 해야 할거 같네요 렉과 발열이 심하고 스마트폰도 버티지 못하는수준입니다 하루동안 재미있게 플레이 할수있어서 좋았고 감사합니다!
5,그냥 시간 녹음 개고트
1,모조리수동 짜증나 안한다 별 하나도 아깝다
5,아 스토리가 꽤 좋내요 액션도 좋고 일단 소과금 햇습니다 진지하게 즐겨볼 생각 입니다
1,"명조만큼은 아니라도 부자연스러운 스토리의 작가수준, 스킵이 존재만하고 필요할땐 거의 못씀 , 공장 최적화가 주컨텐츠지만 오브제 가짓수 적음. 재료와 생산량 시간 모든게 멋대로라 오히려 최적화에 방해 , 생산속도 증가등의 강화 애드온등도 없음 , 이리 자동화 공장장을 시키면서 쓴맛고추같은 아이템은 재배기 사용불가 아예 농사 지어야함 (공장겜이라더니?) 무릉가면 하드리셋. 제강호 써도 자원 이동수량 제한 정작 후반지역진입시 기존 공장들 자원 대부분이 무쓸 NC발에 비하면야 0.8%로 이 정도면 싶은 확률이지만 이론상 120천장이 아닐경우 무한 픽뚫이 가능하며 본인이 레바테인 명함천장치려다 앰버 3돌 했음, 그래놓고 폭사 방지를 뭐나올지 모르는 다음 픽업권을 주고서 폭사방지 운운 , 캐릭뽑기를 하면 무기뽑권을 주지만 이 또한 픽뚫 확률이 75% , 와중에 충전대비 가챠재화 교환비도 창렬한데 120천장 이월조차도 안된다 ,페그오 수준의 역대급 개창렬 BM"
5,우주갓겜
1,일단 쓸데없이 건설하기 흐름끊기는 퀘스트 너무 화가남 ;
4,공장 싫어하는 사람은 싫어할수있음
1,별한개 주기 싫은데 1개도 많아요 ㅠ
1,수차탐색 만든개발자 짤라라
4,"아쉬운점이 없는건 아닌데, 잘만든 게임은 맞음. 오랜만에 오픈런 연차낸게 후회되지 않는 신작게임인듯"
5,"딸깍충이라..저도 처음에는 공장이라는 시스템을 전혀몰라서 어렵고 귀찮을것같아서 처음에는 안하려고했지만 캐릭터와 그래픽 퀄리티가 굉장히 좋아서 시작했습니다. 그런데 하다보니 뭔가 제 월드를 제가 직접 만드는 기분을 느낄수있고 그래픽이나 캐릭터 모델링도 좋아서 계속 하게되더라구요. 단기간에 많은 재화를 얻고 귀찮은게 싫으신분들은 선호하지 않을수있지만 천천히 게임을 조금 ""즐기면서""하다보면 재미있는것같습다."
5,공장은 좀 귀찮아도 하다보면 좋고 캐릭터 이쁜거 하나로도 난 이미 힘이 난다
5,처음 시작했을 때는 이게 맞나?라는 생각이 들 정도로 생소한 컨텐츠가 있어서 어떻게 해야할지 감이 오지 않았는데 게임을 점점 진행해 나갈수록 공장컨텐츠에 점점 흥미를 느끼게 되었고 지금은 게임을 잘 해나가고 있습니다. 하지만 bm이 썩 마음에 들지는 않고 개선해 나가야 할 점이 있다고 생각이 듭니다. 그래도 게임을 잘 즐기고 있기 때문에 5점 드립니다.
5,이미 다른 게임 몇개씩 하고 있는 사람들이 와서 할 게 너무 많다 직장인은 못한다 이러는 건 진짜 이해 안되네
4,꽤 오랫동안 게임불감증이었는데 이 겜으로 오랫만에 몰입해서 길게 플레이 할수 있었습니다. 다만 스토리가 어려워서 이해하기 힘드네요
5,개인적으로는 재밌게 했지만 호불호가 극명하게 갈리는 게임임.
1,이게임 접을게요 (이유:픽돌떠도 하필여풍××××가 떠서)
1,길고 스킵없는 강제영상 시청 튜토리얼부터 지침 개인적으로 튜토가 너무긴데 스토리+튜토 연출에 공들인걸 스킵하기 아까우니 스킵을 없앤느낌이고 너무 과한 스토리연출 짤라서 진행을 했어야 해슴
1,디자인이랑 최적화가 너무 잘빠져서 어떻게든 잡고 해보고 싶은데 일퀘하고 뭘 해야할지 감이안잡혀서 걍 끄게됨
5,일어나... 전선깔아야지... 갓겜임 자다가도 공장걱정함
1,잘 만든 영상인건 알겠는데 스킵좀... 튜토리얼이 심각하게 길어
5,"그래픽이 진짜 장난아니에요. 진짜 역대급으로 좋음... 분위기도 다크한게 너무 제 취향이라 별점 5개가 안 아까워요. 게임이 다소 난해하고 복잡하긴 한데, 공장도 하다보면 거의 완전한 자동화가 돼서 초반만 잘 버티면 진짜 재밌어요."
4,스토리 다시보기랑 무료재화만 좀 더...
1,뎅이터 다운만 종일 걸려도 안됨
5,나에게는 갓겜..개선할 점들이 보이긴하나 처음에 이정도면 여태나온 쓰레기 모바일 겜들이랑 차원이 다름..
5,호불호 갈림. 초반에 강요되는게 좀 많지만 하다보면 계속하게됨
5,그냥 하다보니 하루종일하고있네
3,최적화 그래픽 음악 모두 끝내준다. 데스 스트랜딩 2일 하다가 바로 삭제 아크 서바이브 방송만 봐도 귀찮아 보였다 팰월드 방송만 봐도 귀찮아 보였다. 원스 휴먼 몇 시간 삭제 엔드필드 귀찮아서 못하겠다.
2,"솔직히 올해 기대했던 서브컬쳐 겜인데 가장 실망스러운 게임인거같음. 일단 그래픽, 최적화는 진짜 고트고, 공장겜 좋아하는 사람들이라면 좋아할만한 겜인데, BM요소가 솔직히 오바라고 생각함. 10뽑 = 5,000재화 이건 상관이 크게 없는데, 뽑기를 비싸게 할거면 재화를 많이 퍼주던가, 그리고 여긴 뽑기 스택도 다음 픽업으로 안넘어가서 이거부터 개에바임. 자세한 설명은 생략함. 그리고 솔직히 기존 명방 스토리랑 비슷한 감은 거기서 거긴데, 모든 겜이 그렇듯이 여기도 1장은 개노잼임, 그리고 일퀘 시스템 진짜 개귀찮게 만들어놨음. 일일이 부엉이랑 희귀 자원 언제 캐고 앉아있음. 뭐 딴겜 마냥 의뢰 시스템을 딸각 한번으로 들어갈 수 있는것도 아님. 게다가 아직 게임 출시한지 1달도 안돼서 애매하긴한데. 솔직히 굳이 엔필 추천하진 않는데.. 진짜 다 쌩까고 공장만 지을거면 난 강추함."
5,"스토리 다밀었고 명방도 하프애니버서리때부터 했음. 과금? 필요없음. 기본캐릭터 관리자 포함해서 물리팟으로 스펙 넘침. 과금하면 더 세질수 있지만 경쟁요소없고 엔드컨텐츠까지 전혀 필요없음. 숙제? 궤도에 오르면 거점납품, 물자관리 5분컷만 해도 됨. 택배도 하면 좋지만 굳이임. 단, 그 궤도에 오르기까지 엄청난 시간과 노력이 든다. 서브게임으로는 무리고 최소 일주일에 6시간이상 해야 조금씩이나마 진도 나감. 패키지 게임이라 생각하고 자기 속도에 맞춰 느긋하게 미는걸 추천함. 채집이나 재활용 이런거도 4캐릭 기준으로는 딱 한번씩만 채집해도 충분함"
1,억지로 뛰지도 못하고 걷게 하고 게임을 하면서 답답함을 느끼게하며 스킵 안되는 부분도 있어서 지친다
5,씨앗추출기... 낙공... 와우~
1,겜용량도 개그치큰데 동영상을보라고만든거야 겜을하라고만든거야 ㅡㅡ 10
1,현질 유도가 너무 심하다. 왜 이렇게 가챠 재화가 짬?
5,취향따라 다를 수 있지만 공장도 재밌고 재화도 이것저것 메인스 이벤트 깨면 많이 퍼줘서 하기 어려운 게임은 아닌듯
5,업데이트 내.놔.
4,리워드 5렙 찍으라는건 뭘 의미하는건가요 캐릭레벨도 아니고 공장??? 스토리?? 5레벨도 넘었는데
3,"솔직히 재미없는건 아니다 공장 시스템은 잘 만들어놨다. 근데 공장을 제외한 다른것들이 너무 재미없다. 스토리,퀘스트,전투 다 뭔지 모르겠고 모델링도 남자npc들만 전부 다 이상하니 불쾌한 골짜기가 온다. 뽑기재화도 500개에 1뽑이다보니 상대적으로 재화가 덜 들어오는 느낌이 든다. 공장겜만 할거면 취향에 맞을 것 같다"
5,공장 자체는 매우 재밌음 그러나 공장을 돌리기 위해선 광물이 필요함 광물위치찾는게 너무어려움 옆에선 적들이 전선은 깔아야하는데 지도가 너무 복잡함 그냥 길안내하듯이 찾을수있었으면 좋겠음
5,재밌는 공장게임
5,양산형 혹은 호요버스식에 익숙해져 있는 사람들은 불호 심할 게임인 반면 그 와중에 취향에 맞는 사람들이나 혹은 기존 콘솔 게임 좋아하던 진성 하드코어 게이머들은 좋아할 만한 게임인듯... 무릉 넘어와서 느낀건 스토리는 실드 힘들고 그 외에는 웰메이드에 깊이도 적당히 있는데 이런 도파민 발사의 대척점 어딘가에 있는 게임들은 진성 게이머들은 반기는 쪽의 게임이지만 대중적이기는 힘듬. 그 증거가 여기 1점짜리 리뷰들임...
1,개발자가 말했던 '전투형 서브컬쳐 게임' 과는 아예 다른 게임 오히려 팰월드의 거점짓는 시스템이나 각종 타이쿤 장르를 더 닮음 그냥 청사진 딸깍 하면 되는거 아닌가? 싶겠지만 청사진은 모든걸 완벽하게 해결해주지않고 필요한 재료에 따라서 유기적으로 공장을 바꿔주기도하고 최적화해주기도 해야함 게다가 거점을 새로 시작해야한 시점에서부터는 청사진을 딸깍 할수도 없으며 모든걸 내 손으로 만져야하고 이게 사실상 전투보다 몇배는 더 오래걸림 정작 전투는 현재기준 컨텐츠라 할만한게 없으며 평타 비중이 80%정도 됨 공장을 그저 지겹고 재미없는 숙제로 생각하는사람이 있다면 게임을 절대 해서는 안됨 그런 성향의 유저들은 무조건적으로 이탈이 발생할수밖에 없는 구조
1,모바일회원가입이안되는데어쩌라는거야?
1,뽑기 재화를 쥐꼬리도 안줘놓고 뽑기 10회마다 5000개가 말이냐? 무과금죽이는 게임임
1,"플레이어가 학습해야할 정보량이 너무많고,UI도 적절치 못함. 키맵도 혼선이 생기기 쉬움. 과금BM도 여태껏 해온 오타쿠게임중 가장 매움. 우마무스메보다 심한거같음. 비쥬얼적으로만 만족스러운 캐릭터 진열 프로그램. 맵 상호작용시 애니메이션도 부자연스러움. 오픈월드를 하고싶었으면 캐릭터에 파쿠르 기능을 넣었으면 좋았을듯. 차라리 명방1이 플레이면에선 더 편함"
1,튜토리얼을 대체 얼마나 하는거임 내가 게임을 하는지 애니를 보는지 모르겠음
5,취향 안맞으면 하지를 마셈 난 재밌어서 계속하는중
5,"하고 느낀 점, 우선은 오타쿠 씹덕용 캐릭딸 양산형 가챠 게임할 거면 번지수 한참 잘못 찾았고 오히려 공장 만들면서 보너스로 3D풍 애니 캐릭터 가미된 게임으로 보는 게 맞는 듯 재차 말하지만 블아? 원신? 뭐 그런 캐릭터 보는 겜 원하면 그냥 하던 게임이나 열심히 하면 되고 팩토리오 같은 공장 게임을 원한다면 강추"
