score,content
1,일단 스토리가 너무너무 지루함.. 중국겜 특유의 있어보이는 척 하면서 지들만 아는 고유명사 남발에 이유도 없이 별것도 안한 주인공 보고 대단해요! 하는거는 둘째치고 사실 이런 섭컬류 게임은 웅장하고 대단한 복선 오지는 스토리라인까지 갈 필요도 없고 그냥 캐릭터 매력 어필만 잘해도 오타쿠들이 희대의 명작인 거 마냥 올려쳐줌 근데 당장 첫 픽업 캐부터 메인스토리 초중반에 나오지도 않아서 도저히 이 캐릭터를 뽑아야겠다는 흥미가 안생김 그냥 공장짓기 튜토리얼을 메인스토리에 끼워넣어버려서 안그래도 지루한 게 더 지루해짐 그리고 공장 짓기 게임이 하고싶었던거면 굳이 오픈월드 rpg를 넣을 필요가 있었나? 두 마리 토끼 다 놓친 느낌 몹들은 개성없고 맵은 회색빛에 칙칙하고 요새 중국겜들 초반에 꼭 그놈의 차이나넘버원식 중국모티브 맵 지긋지긋함 bm은 또 주는건 20 30씩 주면서 뭔 1뽑 돌리는데 500이 들어가서 되게 기분이 잡침 짠돌이 느낌? 진짜 딱 캐릭터 얼굴 모델링 하나 만족스러움
1,아직 개선해야되는게 많다 해묘야 특히 bm이랑 가챠 재화 수급처 그리고 전투
5,"공장게임+서브컬처,RPG 기대한 사람들이 많은 것같은데 3일정도 해봤는데 꾸준히 하면 즐길 수 있는 게임인 것 같다. (공장게임을 원래 엄청 싫어하는데 이건 재밌는 듯) 뭐라뭐라 말이 많지만, 라이트하게 즐기거나 하드하게 즐기면 좋은 게임이다"
1,스토리가 별로 공장이라는 특이한 시스템을 도입했지만 그마저도 실패 애초에 이게임을 대체하는 게임 많음
2,무릉 공장 대가리 아프네;;
5,미친 공장 괴인이 되는게임
2,그래픽이 대단히 훌륭하며 모바일에서도 게임패드 적용이 완벽히 되어있습니다만... 재미는 글쎄요... 좀 애매합니다...
4,"음...캐릭 사기안치고 생각보다 재밌긴네요 약간 젠존제하고 원신 합친 느낌? 그런데 너무 복잡한 UI, 접근이 쉽지않은 게임성, 오랜 시간 걸리는 공장 시스템, 고사향 기기 요구가 너무 발목잡네요 본인 S9인데도 핑튀김, 그래픽 최저로 맞춰도 보스전때 끊김이 있어요 PC로 하시는걸 추천드려요 특히 스토리가 중간중간에 너무 많고 맵도 난해해서 뉴비들이 정착하기에는 쉽지않은 겜 같네요 적어도 UI정도는 수정해주시면 감사할거같습니다 그 외에는 할만합니다 젠존제 나 원신하신분이면 금방 적응할듯요"
5,^^최고예요감사합니다고맙습니다^^
3,"무과금으로써 10회에 5000개는 진짜 부담돼요 다른 게임들은 적어도 1600개 최대 3000개 정도 인데 재화 모으기도 힘들고 노동이 진짜 레전드,, 캐릭터 이쁜 중노동게임"
1,내가 광맥하나 파기위해 전봇대 수십개 설치하고 맵넘어다니면서 까지 이게임을 하고싶진 않네요
1,쓰리기게임 돈만 밝히는.게임
1,최적화에 감동 받고 공장시스템에 충격 받고 겜 던짐
5,50렙 찍고 후기남길 자격이 생긴듯하여 후기를 남깁니다. 만신 감사합니다.
1,공장 그리고 입문할때 튜토벽이 겁나높고 노잼
1,"달에 최소 20만원이상 써야 ""명함""이라도 다 뽑아갈수있음. 캐릭터 스킬 조합이 반강제라서 마음대로 덱 짜지도못하고 파츠팔이 픽업 가능성 매우 높음. 전작 명일방주 재밌게 몇년했어서 다운해봤는데 아주 많이 실망함. 앞으로 할일 없을거같음."
1,그냥 bm이 너무 살인적으로 비쌈 지를 엄두가 안난다
1,캐릭터 디자인에 너무 신경을 안 쓴거 같음. 대체 어떤 캐릭터를 좋아해야할지 모르겠음
1,bm 창렬함
1,스토리 ㅈ노쟘
1,그래픽과 최적화 말고는 별로인 게임
1,전투 구림 bm 비쌈
3,이것저것 문제 많긴한데 일단 닉네임 버그 고치고 닉변좀 시켜줘라
1,순수 노잼
1,순수노잼1황..
5,와! 시간삭제
2,"짜증나는 점 -> 1. 번역 이슈 // 2. 더빙이 캐릭터끼리 대화하는 게 아니라, 외운 대본을 마구잡이로 읽는 느낌 // 3. 공장 컨텐츠를 제외하고, 보상이 지나치게 짜다 // 4. 겉으로 보면 타 가챠게임에 비해 싸보이지만, 계산해보면 이 게임이 제일 비쌈 4-1. 유저가 손해를 볼 수 밖에 없는 천장 시스템 4-2. 가격대비 부족한 재화 4-3. 타 게임 대비. 들이는 시간에 비해 수급량이 지나치게 적은 무료 뽑기 재화 // 5. 부족한 액션성 강공격이나 점프공격의 파생기도 없고 저스트회피를 해도 딱히 피드백이 없다 // 좋은 점-> 라이트한 공장게임 재밌다 // 캐릭이 예쁘긴 함 // 필드 자체의 기믹은 10년대 초중반 즈음의 웰메이드 콘솔게임 하는 것 같음"
1,"쓸데없이 꼬아놓은 BM, 특히 요즘시대에 확천 이월 안되는거부터 좋은 소리 할 순 없네요 전투도 평타 비중을 낮추고 스킬 난사하는 느낌이 나야 재밌어질거 같은데 지금은 쿨타임이 너무 길어서 전투가 늘어지는 경향이 있네요"
5,잼씀
3,기대를 너무한듯
3,기대 많이 했는데 좀 아쉽네요.. 재밌긴한데 개선이 많이 필요할 것 같아요
1,"4년의 기다림, 그래픽 OST는 수작. 허나 게임성 지체만 놓고본다면 ""순수하게 노잼"" 전투가 메리트가 있는것도 아니고 스토리가 좋냐? 스토리는 뭐 오픈 초기니까 그렇다치고 넘기는데 메인 컨텐츠로 보이는 공장이 심도있게 깊이가 깊은것도 아님 호불호 많이 갈릴듯, 일단 난 메인스토리만 다 밀었지만 나랑은 도저히 안맞고 공장이고 뭐고 그냥 알아야 할게 너무 많아 피곤해서 하차.. 게임 자체가 굳이 이걸 해야하는 메리트가 없음.."
5,그래픽 하난 끝내줌
5,평점 왜 낮은지 모르겠네요 최적화 최고구요 원래 이런 게임 스토리 안보는데 한번 보면서 게임하니까 재밌더라구요 그리고 과금 많이 하지않아도 스토리 충분히 밀 수 있습니다 실력이 중요해요
2,뽑기쓰레기 스토리매우구림 공장은재밌음
1,4협곡 스토리 재미없음. 편의성 ㅈ박음
1,게임 6시간 해봤는데 아직 많이 부족함 그냥 솔직하게 말함 빛 좋은 게살구임 그래픽-좋음 최적화-좋음 모델링-괜찮음 전투-노잼 타격감 1도없음 기대 많이했기에 뭔가 더 매우 아쉬운 느낌 곧 지존조세 채널에 아쉽다고 영상 올라올듯
1,"그래픽, 최적화, 모델링, UI는 잘 나왔음. 대신 핵심이라고 할 수 있는 전투, 공장 둘다 호불호가 굉장히 심하게 나온 편인데 불호가 더 많아보임. 캐릭터 디자인도 뒷모습 치장 요소가 주렁주렁 달려있어서 뒷모습을 자주보는 3D게임 특성상 마음에 안들었음. 근데 후발대게임이 스택이월도 없는 BM으로 나왔다는 점 때문에 1점 남김."
1,기대가 너무 컸다..
1,게임이 애초에 재미가 없음
5,생각을 바꿔서 생각해보면 공장겜에 미소녀가 추가된거니 갓겜임
2,솔직히 쉴드치기 힘들만큼 별로임... BM개비싼데 스토리도 그냥 그렇고 전투도 재미가 없음. 그래픽만 좋은 빛좋은 개살구
5,리뷰들을 보니 기존 모바일 게임 플랫폼에 길들여진 가축들이 많구나 싶네요..
3,4시간정도 해본후기 그래픽 매우 좋음. 최적화 잘됨. 공장 강제노동 호불호 심할 것 같고 뽑기재화도 드럽게 안줌. 비싼겜.. 아직까지 스토리 노잼. 내 기대와는 많이 다름. 가챠 많이 맵다. 망겜은 아님
2,등반 왜 없냐? 그리고 가챠재화를 무슨 고기를 이베리코 마냥 얇게 썰어서 맵 전체에다가 퍼뜨려놨네. 최적화가 개쩔어서 2점으로 준다
1,에휴
1,뽕채워주는 맛이 너무 적음. 공장시스템 접근방식 형편없었음. 몹들피통만 괴랄함 초반인데;;
1,스토리 보다 삭제하겄다 ㅡㅡㅋ 건너 띠기라도 해나라
1,너무나도 아쉽다.
1,취향
5,"호불호가 갈리는 게임같음, 어렵고 뽑기가 맵다는의견에 동의하지만 게임에 정말 공들였다는게 느껴짐 최적화 모바일은 기대안했는데 진짜 기가 막힌다 UI나 아트 퀄리티도 역대급인것 같다 공장이 생소하고 어렵기도 하지만 뭔가하나 해결해내면 스트레스받다가도 성취감이 있음 ㅋㅋㅋ 지금 80레벨까지 육성했는데도 데미지가 좀 약해서 전투가 답답한 느낌이 있음 분명 키웠는데 안 강해지는 느낌"
5,해묘는 신이야
5,"캐릭터 모델링이 매우 예쁘고, 공장 꾸미는 재미에 주말내내 시간가는 줄 모르고 즐김. 가챠게임이 아니라 준수하게 잘뽑힌 패키지게임 하는 재미가 있음."
1,BM너무 창렬 충분히 가능성 있는게임이나 고칠때까지는 1점일듯
5,공장자체는 청사진도있고 점점익숙해지니 그리어렵지는 않음 전투조작난이도도쉽고 기믹들도 어렵지않음 뭐든지첫인상이중요한법인데 이게임은 초반에 정보량이너무많다고하는데 알아야되는 내용들이 알고나면 딸깍딸깍하며 쉬운내용들임 원신.명조.기타서브컬쳐게임들보면 저세히튜토리얼 상세한설명들 기믹설명보면 개네들도만만찮게 많고알아야하는내용들이 산더미임. 초반기틀잡는게 좀 난해하고 익숙하지않은 내용들이라 좀호불호가심하게갈리는듯함 게임완성도는 높은데스토리가 좀..아쉽고 나머지는일일이따져보면그렇게막 안좋은거같진않음 그냥 게인성향차이에따른 호불호인듯 게임이좀매니아틱함 나도초반엔 진짜재미없었는데익숙해지다보니까 공장류게임을처음해보는데나도 나름재밌게하고있는중임.명일방주를정말오래해본유저로써. 하이포그리퍼?는 게임에 애정이많고 여러차레 수많은시도를 많이해보고 열정적인게보임 나도 그걸보니 명일방주란게임을 정말오래붙잡고할수있었던거같음.bm비싸다고하는데..캐릭명함하나천장해서뽑우면 전무는사실상 공짜임돈으로따지면명전은딴겜보다쌈
5,잘만든 게임 같아서 응원하고 싶음 더 발전하면서 매력적인 캐릭터랑 스토리가 이어지길 기대함
5,"브레인롯, 팝콘브레인에 찌든 요즘 애들한테 노잼이라 까이는 겜. 취향만 맞으면 상당히 재밌지만 BM실드치는 디시, 아카애들 보면 뒷통수 마려움. 한정캐 신경 안 쓰고 콘솔겜처럼 느긋하게 플레이한다면 추천."
1,겜시작하고 7시간을 거진 공장을 떠먹여대는데 도대체 이게 무슨.. 이게 진심으로 재밌다고 생각한건지 의문입니다
1,순수하게 쟈미가 없는듯...
1,"와 전작 캐릭터들은 전부 죽고 반가운 얼굴들은 클론이래요 돈만 쫒는 게임은 필히 망해야한다고 해묘본인입으로 말한것 같은데, 후속작에서도 어떻게든 캐릭터팔이는 해야겠죠?"
2,타격감이나 이펙트 등 전반적으로 전투경험이 별론데 어떻게 기존 오픈월드식 BM을 더 비싸게 받아먹는지 전혀 이해가 안감
5,약간 콤보 하는 맛이 있음
1,bm이 너무 심각함 근데 광산도 사료도 엄청 적음 2주마다 픽업캐 나오는데 2주마다 20만원 쓸거 아니면 쉽지 않음
1,스킵도 없고 스토리 겁나 기네 ㅡㅡ 이럴거면 애니를 만들지 뭔 스토리를 다.쳐보게 만드냐 생각하는거 하고는
4,캐릭터가 이쁘고 개성있으며 공장 시스템이 좀 빡세긴 하지만 공장 시스템이 없으면 다른 게임들과 다른점이 없는거 같아 하는중입니다 공장 시스템이 특이하고 개성 있지만 공장이 빡세 점점 질리는 중 입니다 하지만 게임은 좋은니 공장 시스템이 마음에 드시거나 아님 시간이 좀 비워져 있을때 하시는 것을 추천드립니다
2,지루하고자유도가부족함
2,과금 BM구조가 말 안됨
5,팩토리오 같은 게임좋아하면 충분히 재미있음
4,게임 정말 재밌습니다 공업시스탬도 신기하고 맵도 이뻐요 근데 가챠가 좋나 더럽습니다 6성 9번나왔는대 전부 픽뚫났어요.
1,1점도 아까움 0점게임
2,관리자 레벨 16찍고 5시간 정도 했음. 그래픽 부분에서는 모바일 게임 중에서 최정상이라고 생각함. 하지만 딱 그정도 수준임. 스토리는 데스 스트레딩을 참고한 것 같은데 도대체 무슨 내용인지 모르겠음. 결국 이상현상으로 잠식된 행성을 다시 재건한다는 흔한 중국산 모바일 게임 단골 스토리인데 지들만 알아듣는 말만 쓰고 서사나 연출이 쓸데없이 웅장함. 초반에만 신선하고 점점 갈 수록 힘빠지고 피곤함. 게임 플레이를 보면 제작자가 여러가지 장르를 많이 시도한 노력이 많이 보임. 하지만 욕심이 너무 많았음. 오픈월드+공장+제노블레이드식 전투 매커니즘 등등 어디서 해본 장르들을 모두 섞으니 시스템이 하나씩 나사가 빠져있음. 그 와중에 속성 시스템이나 공장 시스템은 튜토만 10여개씩 있으니 다 익힐 생각에 너무 복잡하고 피곤함. 결국 그래픽만 좋고 나머지 요소가 부실한데 쓸데없이 많아 나중가면 피로감만 누적되는 게임임. 오래하고는 싶은데 리세도 힘들게 해놓고 가챠도 조지니 정이 뚝떨어짐.
5,공장 하나 못 짓는 빡대가리들 1점 박는 수준 ㅋㅋㅋㅋㅋㅋㅋ
2,튜토리얼이 너무 재미없어요..
5,진짜 너무 매력적이고 재밌는 게임입니다
1,"사양이 너무높음. 어지간한 폰,테블릿 아니믄 하기힘듦."
1,진짜 순수하게 재미가 없어요
4,"전투나 모델링, 최적화등 전부 만족스러웠는데 공장이 발목을 잡네요. 공장 요소가 취향을 타는지라 이 부분만 본인에게 맞으면 만족스럽게 할 수 있을 것 같아요."
1,뭔가 잘 해보려고 노력한 티는 나는데 좋은 평가는 못주겠음. 공장겜이라기엔 모듈들이 너무 늦게 열리고 내가 할수있는것도 많이 없고 액션겜이라기엔 답답하고 몹들 썰어넘기는 재미도 적고... 진짜 좀만 고쳐주면 좋을것같은데... 캐릭터 모델링이 아까운겜임. 설문조사 항목들 보니 다 인지는 하고 있는 것 같은데 나아지길 바라는수밖에.
1,돈에 미친겜 때깔만 좋고 게임에 속도감도 없고 루즈하다
5,"명일방주 5년차, 원신ㆍ붕스ㆍ명조는 오픈 유저인데 앞의 넷은 시작부터 빠르게 흥미를 가진 반면 엔드필드는 이틀 플레이할 동안 계속 극심한 불호였음. 그런데 공장튜토 대충 끝난 이후부터 조금씩 어라?어라?싶더니 결국 너무 맛도리라서 눌러앉음. 진행할수록 컨텐츠 진짜 다양하고 재밌음. 공장이 다가 절대 아닌데다 공장이 진짜 너무 싫다해도 청사진으로 딸깍 외장뇌 가져올수 있음. 튜토리얼 잘 만들어두니 나중에 찾아볼때는 좋은데, 가장 중요한 초반부에 제대로 된 도파민없이 지루한 강제주입을 너무 오래 시키는게 호불호를 떠나 그냥 개큰문제라고 생각함. 그리고 전투는 잡몹 피통만 줄여줘도 불만 덜 나올것 같은데 BM은 약간 걱정되긴 함. 메인스토리는 개인적으로 로시 등장 후부터 괜찮아짐."
5,"느긋하게 콘솔게임 하듯이 즐기면 분량도 많고 재밌는 게임이 돼요 어차피 나중가면 자원은 쌓이고 넘쳐나기 때문에 강박적으로 빨리빨리 밀려고 안해도 되고.. 스토리는 매우 느리고 길게 진행되는데, 불호 여론이 많은것 같지만 전 만족스럽게 즐겼어요 대신 인게임에서 뿌리는 가챠 재화가 요구량에 비해서 한참 부족한게 아쉬워요.. 4번협곡 스토리를 거의 다 밀었는데 이제야 50뽑 정도 할 수 있을거 같아요.."
5,전작부터 그냥 재밌음
4,뭔가 되게 많이 준비한게임인건 확실하네요. 튜토리얼만 30분이라 저는 못하겠습니다.
5,해묘사랑해
4,나쁘제않음 게임이 어려운데.. 즐길라면 깊은 시간이 필요할듯함
1,전투 답답한게 몹은 많은데 거의다 단일 공격이라 너무 오랜 시간이 걸림 특히 평타 모션이 거의 모든 캐릭 다 느려요 극한 회피는 진심 왜 만든건지 모르겠어요 회피해서 좋은게 없어요 게임이 전체적으로 뭔가 난해해요 기능은 많은데 이걸 다 신경 쓸 겨를이 없고 스토리랑 bm은 잘 모르겠고 제일 좋은게 캐릭터랑 그래픽밖에 없네요
1,게임이 아닌 노동 현장 다큐멘터리를 보는 기분이다
5,굿
1,공장 늅 줄폐사 를 뚫고가봐야 뽑기 개같이폐사 유툽에서 고통받는거 구경만함 시도할 엄두가 안나는게임 이쁜쓰레기 ㅋ
1,"그냥 겜이 홍대병걸려거 모든걸 망침 불쾌함의 결정체임. 전투, 스토리 다 엉성하니 기존 하던겜들 하면 될듯"
4,공장 시스템이 별로임. 버튼이 많은데 뭐가 뭔지 모르겠어서 편의성도 별로임. (이름을 붙여줘야 함.) 게임이 귀찮은 걸 잔뜩 주기 때문에 재미를 느끼려면 오랜 시간이 필요함. ( 공부하는 느낌 ) 차라리 팰월드처럼 복잡하게 만들 필요없는 공장으로 만들었으면 좋았을텐데 공장 시스템이 너무 과함. 그래픽만 좋음. 발전하려면 전투를 메카물로 바꿔야 하고 칼 들고 싸우는 건 좋은데 칼이 평범한 거 말고 인공지능이 들어간 칼이라던지 외계물질로 만들 칼이라던지 해서 폭탄도 막고 총도 막는 칼이 있어야 할 듯 공장만 주구장창 만들고 대중들이 좋아할 만한 전투를 가져다 버려버리니 평가가 구리지 공장 잘만들었는데 나무를 보지말고 숲을 보란말이야
1,계산적으로 하기어렵게 만든bm 초창기 광고와는 다른 이벤트
1,공장이고 전투고 나발이고 인게임재화가 너무 짜고 bm자체도 너무 비쌈 그런 주제에 가챠는 버전당 3개인게 벌써 불쾌함
3,컷씬에 나오는 오퍼레이터와 내가 직접 설정한 오퍼레이터가 다른 너무어이없는 상황.. 전투는 따로 퀘스트는 따로 이래서 너무 이상해요 서브컬쳐겜이 캐릭터에 대한 애정인데 이건 애정은 커녕 전혀몰입이 안됀다고요 그래서 6성짜리 뽑아놓고도 구냥 원래캐들로 계속 플레이하고잇다구요! 어떻게좀 해봐요
3,지금까지 해본 감상으론 그래픽의 이점을 제외하면 다른 게임들을 하던걸 버리고 여기로 올 이유가 있을까?란 생각이 든다. 공장 시스템은 서브컬쳐 모버일 게임내에선 신박한 시스템으로 자리 잡긴 했지만 재밌냐고 묻는다면 호불호가 있을듯 하며 전투 또한 명조에 비해서 큰 재미는 느끼지 못하였고 컨텐츠가 많은것에 비해 깊이는 부족한 것이 많았다 솔직히 상자깡은 이제 질린다. 특히 가챠는 지금까지 없던 스타일로 나온듯한 느낌인데 상당히 복잡하면서도 혜자인 것 같지만 창렬함에 가깝다 오픈 초기임에도 재화가 잘 모이지 않는다는 점도 크다. 명일방주 5년차 유저인 입장에선 기다림도 그렇고 마케팅에 비해서 뭔가 나사 빠진것이 많이 보여 참 아쉽다
2,"그래픽이나 스토리는 좋은데, 공업 시스템 쉽게 개선안하면 유저 대부분 이탈할 것 같아요. 게임하면서 튜토리얼이 너무 많고 스트레스입니다."
1,노잼
4,게임은 재밌는데 bm설계는 제발 수정좀..
1,스마트폰으로 하기 어렵고 지루함.
5,갓겜
2,그래픽이나 최적화는 좋은데 재미가 없어요
1,편의성은 박을대로 박고 bm은 소과금 유저한테 친화적이게 한다더니 전혀 아님ㅋㅋ 해묘야 일해라
1,재미없어요
5,재미있는데 왜그러지
1,"비싼데 그 내용을 파악하기 힘들게하고 소비자의 실수를 유도하는 악질적 bm, 놀랍도록 지루하고 재미없는 전투, 게임 내에서 홀로 독보적으로 튀지만 타 요소와 전혀 녹아들지 않는 생산라인 운영요소까지. 여러분의 시간과 핸드폰 용량은 소중합니다."
1,bm은 맵고 스토리는 재미없고 공장은 너무 귀찮고 전투는 중간에 붕뜨는 시간이 너무 많음
1,픽뚫 픽뚫 픽뚫 픽뚫 픽뚤 픽뚫 갸차 겁나 매워요
1,그 누구도 만족 못시키는 잡탕밥 게임
5,첫느낌이 뭔가 니어오토마타같은 대작냄새가
3,진짜 게임 나온지 3일동안 하루종일해본 평가를 남기겠습니다 튜토리얼이 생각보다 깁니다 튜토리얼 시작해서 공장까지 끝내는데 한 2시간정도는 걸린거같더군요 뭐 그래도 시스템이 복잡하니 튜토리얼은 그럴수있습니다 하지만 스토리는 또 엉망이라 보기가 좀 어렵네요 스토리는 엉망이여도 보스전은 또 재밌다고 봅니다 하지만 재화를 주는 양은 뽑기 가격에 비해 너무 적게 줍니다 10뽑에 5000이 들어가는데 임무 하나 하는데 한 40~100?정도 주더라고요 맵을 돌아다니면서 상자 해금하고 이것저것하면 15~150정도는 주는데 10뽑모은다고 하루종일해도 10뽑이 모일까말까합니다 다른게임들에 비해 뽑기비용은 넘사벽이면서 재화는 또 적고 그렇다고 6성 확률은 또 그렇게 높지도 않네요 나중에 스토리같이 재화 수급처가 없다면 어떻게 해야할지도 의문이고... 그래도 전 전투시스템은 참 마음에 들었습니다 보상주는건 참 애매하고 뽑기 비용은 너무 많이 들고 그렇다고해서 그래픽이랑 공장짓기 전투 등 이런거는 좋네요
1,해야하는게 너무 많아 복잡하며 스토리도 지루해서 넘기는게 많음.
2,시대를 제대로 역행 했다고 볼 수 있는 게임 불편하고 짜증나는것 투성이임 그래픽 만큼은 역행하지 않아서 2점
3,전투랑 공장은 나름 입맞에 맞다고 느꼈는데 (물리덱 사용중임) bm(특히 상시 광산)이 시대착오적이고 스토리가 전작처럼 깊은 맛이 안나서 아쉽네요
5,PC로 플레이하던 중 휴대폰으로도 하고자 다운로드 받았습니다. 왜 이렇게 평가가 극단적으로 갈릴지 생각을 해봤습니다. 가챠 확률이 극단적으로 낮다는점은 동감합니다. 하지만 명함도 못뽑을 정도냐? 그건 아니라고 봅니다. 명함 뽑고 돌파할 정도로 주질 않는다 뿐입니다. 돌파부턴 과금의 영역이라고 생각하시면 됩니다. 픽업 명함 하나만 뽑으면 진행가능한데 왜 이렇게 찡찡대는 사람들이 많은지 모르겠습니다. 캐릭터 수십개를 뽑아서 돌파를 무조건 해야되는 게임도 아니고 돌파 없이도 진행이 가능하고 4~5성 캐릭터도 파티에 포함되어 있어 캐릭터 부담 없는데다 배포 6성도 성능캐를 주는데 BM 맵다고 찡찡대는거 보면 도둑놈 심보가 따로 없습니다. 공장 컨텐츠는 호불호 갈릴만 하지만 재밌는 사람은 재밌게 하고 있습니다. 심지어 다른사람이 마련해둔 청사진 사용해서 그냥 날로 먹을 수도 있는데 왜 이리 불만인지 모르겠습니다. 추가로 이 게임 PC나 콘솔에서 패드로 하시면 죽여줍니다. 듀센 완벽지원 됩니다
1,전투와 공장 서로가 서로의 흐름을 끊어먹고 스트레스를 유발한다. 서로가 서로를 편하게 해줘야 이것도 좀 더 해볼까가 되는데 서로를 불편하게 하니까 그냥 스트레스가 배로 옴
1,"전투, BM 개편이 필요함 이 상태로는 못함"
5,"벌써 수십시간했네요. 적당히 지를수있어서 BM도 착하고, 특히 그래픽,최적화는 진짜 인정합니다. 갓겜이네요. 돌파효율늘려서 과금유도만 자제하면 오래잡고 할것같습니다."
5,취향 차이일지 모르겠지만 게임 재미있게 하고 있습니다. :)
4,완성도와 퀼리티가 여타 서브컬처게임이랑 비교했을때 압도적으로 좋다
3,"게임 자체는 막 나쁘다고 할 수는 없으나, 초반 튜토리얼 과정이 너무 질 하고 뻔한 기억상실이라 지겨운데, 스킵도 안돼서 상당히 불편합니다. 공장시스템과 서브컬쳐를 조합하여 새로운 재미를 추구하려 한 거 같으나, 이도 저도 아닌 느낌이 강합니다. 전반적으로 액션은 만족스러우나, 연계스킬 아니면 주위 AI파티원들은 어디 드라마 전투씬 잡무리마냥 싸우는지 안싸우는지 잘 보이지도 않고 알지도 못하겠습니다..그래픽과 최적화는 발군입니다."
1,스토리 전투 bm 탐험 전부 노잼
5,"모바일 최적화만 좀 해줘라, 공장은 내취향임 ㅎ"
1,아니 이건 부자들게임이다 뭔 10회뽑는데 5000개? 이걸 가챠를 하라는겨 말라는겨 1500 2500도 아니고 5000천개 선넘네 진짜 ㅋㅋㅋ
1,평범한 전투 액션 머리 아픈 공장 시스템 회사 생활 후 즐기기보단 피곤한 숙제느낌이 많이나서 저랑 맞는게임은 아닌듯 합니다.
