score,content
1,안녕하세요. 2월 7일 오전 1시에 계정을 분실 했는데 3월 2일 현재 3월 2일 까지 복구가 안 됐네요. 1달간 이게 뭐하는 짓인지
1,그냥 명조하러가면되지 이겜 해야하는 이유가?
3,"이 작아 보이는 땅에 너무 많은 걸 넣을려고 해서 더 많은 걸 망친 거 같음. 빼도 될거 같은 걸 넣고, 되려 너무 많은 걸 나눠놔서 복잡해지고, 하나로 통합해도 되는 걸 또 나눠놔서 더 복잡해짐. PC로도 하는데 스펙이 낮은게 아닌데 전투에서 버벅거리는게 있고 반응이 느림. 발적화는 아니지만 아쉽다. 필드는 막아놓은게 많고 길을 뚫어야하는데 내가 재화를 만들어서 해야되는거라 진짜 불편하고 가방도 제한있게 만들었으면서 왜 필수로 가져가야되는 재화를 들고다니게 해야됨? 가챠 시스템은 이해가 안됨. 천장도 높은 편이고 왜 이렇게 만들었는지 모르겠고 돈 벌고 싶어서 그런걸로 보이네. 그리고 왜이렇게 주인공이 기억잃는 게 많은지. 가불기여 뭐여. 액션형 동숲이여? 캐릭터 디자인만 빼면 감다죽임. 개선되고 있는거 같네요. 근데 상시 컨텐츠는 부족하고 상시는 돌릴 여유도 필요도 없고 뽑기권을 얻을 수급처도 없다. 그리고 가챠만큼은 진짜 욕먹어야 됨"
1,뽑기 재화 부족 성장 재화 부족 어지간하면 안하는게 답
5,1일차 평가로는 알수없는 깊이가 있다
5,쟘슴
1,종래 출시 게임들 대비 나은 건 최적화 하나 밖에 없음. 뚜렷한 장점이 없는데 비싸기만 함. 기대 정말 많이 했는데 아쉬워 죽겠음.
5,걍 갓겜임
1,뽑기 이월안되는게 말이되냐?
5,갓겜
1,공장 너무 스트레스에요
2,이본 1돌1재 해보고 느낀점. 무과금 120연차 모아서 명함씩 따는거 아니면 무한 픽뚫에 개빡치는 자신을 볼 수 있음. 과금 할거면 차라리 하던 호요버스 겜에 하는게 답.
3,"솔직하게 말합니다. 이게임 할거면 지루한 공장만들기 버틸수 있으면 하세요. 첫 스테이지 4번협곡은 공장짜기 맵파밍하기 스토리보기 시스템 기능해제등 할만합니다. 그리고 두번째 스테이지 무릉은 스토리보고 기술포인트 먹고 다 가능합니다. 근데 무릉에서 공장 짓기 시작하면 그때부터 엄청난 벽에 눌림니다. 퀄 좋고 브금좋고 스토리 나쁘지 않은데 공장과 재화 모으기 그리고 픽업이 힘듬니다. 본인은 시간 빌게이츠고 자본이 넉넉하고 여유가 있으면 하시는걸 추천 합니다. 주 포인트는 공장 시스템 이해 공장 튜토는 스킵하면 나만 손해보고 재화는 특이하게 초반에 우르르 주고 뒤로는 엄청 안모입니다. 픽업 시스템이 살짝 특이한것? 애매한 부분이 있다고 생각합니다. 무과금은 점점 버티는게 훅 쉽지 않더라고요. 나름 원신,스타레일,젠존제 등등 원신 옛날에 한번 제외하고 이때까지 버티며 왔는데 앤드필드는 쉽지 않더군요. 주는 만큼 뒤는 힘든느낌 전 그렇게 느꼈습니다. 공장을 버틸 자신이 없다면 쉽게 떠날겁니다"
2,게임은 재밌는데 전투중 시선 처리가 심하게 조잡함; 시야고정으로 만들어놓고 돌진하는거 하나 못따라가면 어떡함
1,내인생최악의가챠겜무기픽뚫캐릭픽뚫매전픽뚫나고천장치면누가하고싶은데돈쓰라고?꺼질게~
1,최악의 BM. 돌파하고싶어도 엄청난 비용부담때문에 접게됨.. 이것만 개선하면 성공했을텐데 너무 아쉬운 게임
1,최악의 BM. 돌파하고싶어도 엄청난 비용부담때문에 접게됨.. 이것만 개선하면 성공했을텐데 너무 아쉬운 게임
5,"그래픽이 마음에 들고, 4성 캐릭이어도 조합을 구성하면 충분히 엔드컨텐츠에 도전할 수 있어서, 원하는 캐릭터로 즐길 수 있어서 만족감이 높습니다."
2,난 여기까지..ㅠ
1,"쓰레기같은 BM, 유저편의 일절안봐주고 유저가 게임에 모든걸 맞춰야함"
2,"게임 자체가 할게 많아서 좋긴한데요 너무 자잘한 버그가 많아요. 시점 고정 되버린 것도 되게 사용자한테 불쾌합니다. 또 미션 스킵자체가 안되는 구간이 너무 많아요. 처음에 스토리 몰입하며 진행하다가 어느순간 너무 대화요소가 많고 스킵도 안되니 좀 화가 나더라구요... 또한 미션이 강제성이 너무 심하고 하나의 서브미션이 15분이상 잡아먹으며 뭐 찾기 미션도 1,2개가 아니고 5개 7개...컨텐츠 소모속도를 줄이기위해 이렇게하는건 옳지 않습니다. 게임의 자유성을 느껴야하는데 그냥 주구장창 미션 하나잡고 하루종일 스토리 봐야되요 스킵이 안되니 한번스킵하면 더 이상 대화 나오면 안됩니다. 스킵햇더니 다른 애니메이션, 다른 대화 그것도 스킵이 안되는 구간 발생 하다보니 화가 너무 납니다. 미션 다끝내고 좀 즐기고싶네요ㅡㅡ... 솔직한 리뷰 남깁니다."
5,아오!!! 엔평!!
5,이본 빵댕이 최고!
2,"갸챠 비용이 너무 큼. 이가 하나 때문에 모든 장점을 너무 씹어먹어 버리고 할 맛도 안남. 내가 원하는 캐릭터를 뽑을수 있어야 하는데 10번 할때마다 5000개는 너무 함. 10번에 거의 1500개로 줄여야 하는거 아닌가 싶음. 심지어 픽업 기간도 겨우 15일이라 충분히 모을수도 없고, 그냥 현질 유도하려는 속셈만 보임. 이것 정말 개선 했으면 좋겠음."
1,스킵이 없어서 바로 접음
3,게임은 좋은데 중간중간 공장 만드는것과전봇대 설치가 너무 귀찮습니다 그리고 가챠가 3연속 픽뚫이.. 6성이 픽뚫이 3번이 났습니다 대신 무기는 얻기가 쉽지만 캐릭터가 너무 매워요
5,"사전 예약하고나서 나온지 한 1주 뒤 부터 시작했는데, 할 만 함. 캐릭터도 무료로 6성 준 것도 있고 뽑기도 필요한 만큼 잘 뽑히고(한 달도 정도 되어서 무자본으로 6성 2캐릭 빼고 다 얻음), 공장도 지금 다 자동화 시켜놔서 80000 자원씩 거의 다 완성 됨. 무릉은 4구역 다 하고 나서 갈려고 아직 초반만 함. 연구도 돌아다니다 보면 금방 다 되고. 처음 스토리만 한 3일 열심히 하면 그 다음부턴 그냥 술술 잘 풀리는 듯. -플레이 타임 50시간 기준임-"
1,폰으로 해도 렉없이 잘 돌아갑니다(s24). 단 1장 까지만요. 2장부터는 얘가 광견병이라도 걸린건지 물보면 발작을 하면서 진행이 안될 정도로 버벅이면서 못움직입니다. 컴퓨터로 진행할 분들이라면 큰 문제는 없겠으나 저처럼 폰으로만 즐기실거면 안하시는게 나을정도예요. 심지어 이 문제가 1월부터 말 나온 문젠데 딱히 고칠 생각도 없어보입니다.
4,게임 자체로는 좋으나 다른 요소에서 호불호가 갈리고 혹은 단점으로 뽑힐만한 것도 많다고 생각함
1,컨텐츠가 아닌 불편함과 재화수급으로 유저 플레이타임을 늘리려는 의도가 노골적이라 좀 그러네요...
4,출시전 명일방주 ip 기반의 오픈월드 라는 것만은 알고 있었습니다만 직접 플레이해보니 통합공업시스템(약칭 : 공장)을 할 수 있더라구요 저는 취향에 맞고 좋았습니다 특히 머리 쓴다거나 창작쪽의 일을 할 때의 행복하기 때문에 이런 게임은 환영입니다 많은 노력과 정성을 들인 게임인 것이 보여서 만족하고 있습니다 운영적인 측면에서도 설문조사를 꾸준히 받으며 개선하려는 의지가 좋게 보이네요
2,그지같은 bm 왜 전무를 끼워파냐고
1,설치가 안돼다
5,전선깔기
2,전송 누를 때마다 튕겨서 게임하기 힘듦.
1,오픈때부터 했지만 진짜 최악이네요. 명일방주를 재밌게 하고 있어서 깔았는데 접속할때마다 두번씩 강종되는건 기본이고 게임 렉이나 발열도 심함. 최적화는 둘째치고 BM도 악랄하기 그지없음. 계속 할 가치를 못 느끼겠어서 삭제합니다.
2,전투 매우 심각하게 재미없음. 스토리 개인적으로 재미없어 전부 스킵. 공장 어려운거 없고 그냥 간단하게 건설하고 자동화 가능 그걸 더 깔끔하고 완벽하게 자동화 시키는게 재미있음. 즉 공장 빼고는 심각합니다.
5,PC로 하고있는데 굉장히 깔끔하고 타격감도 좋음 단점:확률 버그. 캐릭터 버벅거림 버그. 랜드 브레이커와 아군 IQ 0 등 장점:공장 운영 시스템. 반오픈 월드. 1점 주는 애들은 뭐하는건지 생각이 안됨
5,이거 완전 재밌지만 취향이 확확 달라서 직접 공장을 만들고 재료 만드는 게 성취감이 있고 캐릭터 키우는 맛이 있습니다 이 게임 전작을 하시는 분들은 대부분 좋아 할꺼라고 생각합니다
5,길게 말 안한다. 펠리카 개이쁨
3,"공장이야 청사진 있다도르 치고, BM 진짜 이딴식으로 계속 가려고? 천장 한 번 치려면 오픈 초인 지금도 모든 광산을 다 쳐갈아마셔야돼. 이게 맞는거냐?"
1,천장 이월 왜 없음?
1,bm은 캐릭터의 120천장이월불가 이것도 쥰내 크지만 문제는 무기임 무기가 처음보면 혜자처럼 보이게 해놨지만 픽뚫75퍼? 이게 말이 안됨 더욱 이상한건 캐릭을 뽑으면 가챠권을 줘서 혜자같지만 캐릭을 뽑아서 주는 재화량이 조온나게 적음 그래놓고 픽뚫 5성무기가 쓸만한가? 이 무기들이 픽업무기랑 비비려면 풀재는 해줘야 비비는 수준 어떻게는 구조가 유저의 돈을 빨아마시려는 구조인데 그냥 역함
3,해묘야 나 말라죽는다 일퀘 주간퀘로만 살기엔 너무 힘들다고..
5,"집라인이나 뭐 재화 얘기들 많은데 노력하면 다 되는문제 입니다 애당초에 엔드필드 조금만 찾아봐도 돌아다니면서 집라인 설치 해야된다고 이미 다 나와있고 공장 게임이라는 말도 있는데 다 무시하고 돌아 다니기 힘들다? 그러면 다른게임을 하시면 됩니다 그리고 재화들은 하다보면 모이는게 재화입니다 그리고 게임내에서 이벤트도 많이 나오고 있고요 지금 레바테인 천장,질베 반천장 이본 천장인데도 현질한게 패스말곤 없습니다 패스가 재화를 더 많이줘서 그런거 아닐까라고 말하는 사람 있을텐데 주긴 줍니다 주는데 겨우 10뽑 될까말까입니다 그러니까 그만 찡찡되세요 편의성 문제도 지적하던데 애당초에 게임이 이런거지 다른게임 편의성에 익숙해져서 다른게임한테 그걸 요구하는게 맞다고 보나요? 충분히 이 엔드필드 게임 상당히 재미있고 불편한점 하나도 없습니다 커뮤니티도 활발한 편이라 정보도 많습니다 그러니까 좀 찾아보고 떠드세요"
1,가챠 너무 맵고 픽뚫이 너무 심함 이거 처음에 퍼주는 걸로해도 한 파티 구성하고 다음 파티 꿈도 못꿈 (파티에 구성원 전용무기 구하려면 무조건 가챠로 얻는 재화인데 그럼 결제하거나 해야지 가능함 무과금은 꿈도 못꾸는 구조임)그리고 그걸 위한 재화가 너무 쪼여놔서 모든게 할게없고 느림 다른게임하면서 즐길거면 상관 없을 듯 너무 매운 시스템 처음엔 못느낌!
4,오픈때부터 달렸는데 슬슬할께 없음
1,"원신,명조 하거나 해본 유저는 알거임 더럽게 불편하고 재화도 너무 짜다. 공장 시스템 좋아하는 사람은 좋겠지만 솔직히 굳이? 싶은 요소임 지능 문제라는 진성 팬 의견 있는데 너 실컷해라 ㅋㅋ 타게임보다 부실한 부분을 공장 시스템으로 떼운 느낌인데 ㅋㅋ 벽타기 정도는 넣어두면 좋겠음 오픈월드 게임인데 바로 앞에 작은 턱이라도 있으면 평지로 돌아서 가는데 ㅈ 나 말이 안됨 ㅋㅋ 일단 여기서 에반데 1스택 적립함 그리고 오픈월드는 딱히 리세 잘 안하는데 어차피 나중에 다 얻기도 하니까 하지만 엔필은 재화 수급 너무 짜서 리세 돌려봄 근데 계속 뜨는 ㅅ 끼만 잘 뜸 조작이냐 ㅋㅋㅋㅋ 뭐 이것저것 따질거 많은데 할 일 없고 친구 없고 시간은 많은데 인생에서 자랑할만한게 지 공장 도면인 놈들이라면 게임 추천한다 그게 아니라면 차라리 원신, 명조나 해라 아 장점은 있지 그래픽,디자인은 잘 뽑긴함 이거 말고는 글쎄 뭐가됐든 유저 감소하면 게임사뿐만 아니라 게임하는 니들도 손해라고 ㅋㅋ"
5,아니 찍먹만 하려고 했는데 정신차리고 보니 너무 깊게 들어왔음... 뭐 앞으로 겜이 크게 사고 치는게 아닌 이상 벗어날 수 없게 되어버렸다... 어떡하냐 캐릭 얘도 이쁘고 쟤도 이쁘고 매력 터지고 아
1,bm이 너무 악마같다 게임 개선도 좀 해달라 제발
1,노잼
1,흠...... 그정돈가
5,호불호 갈리긴 해도 취향 맞으면 재미있음
4,사전예약유저긴하지만 초반에 너무 내 취향이 아니라 탈주하고 거의1달만에 돌아왔다.그런데 유튜브에 캐릭모델링이 쩔어서 다시 찍먹하러왔었다 근데 진짜로 출시날부터 진짜로 많이 뿌렸다 진짜로 뭔가를 많이 뿌렸다 돌아오고 뽑기를 하는데 6성을 무슨 20번만 뽑아도 나오게 만든 것 같을 정도로 정말 확률이 수상하게 좋다 6성도 무료로뿌리고 뽑기재화도 뿌리고 무기도 모델링 잘되어있고 제일 문제였던 이 공장만드는 것을 다시 해봤는데 생각보다 맛있다 진짜 관리자 귀여워서한다 내가퍼리는 아닌데 퍼리가 좋아진다 진짜 어떻게 이렇게 모델링을 할 수있는것이지 근데 공장 만드는게 살짝 어렵다 공장이 취향이면 당장 시작해라 아니여도 한번은 먹어봐라 관리자가 맛있음
3,가챠는 얼마 안해서 모르겠고... 초반부터 너무 일이 많아서 막막함... 이후 업뎃마다 새로운 지역 열리고 그에 따른 배치도 다 달라지고 할텐데 일일이 하게 된다고 생각하면...어우...힘이 쭉 빠짐... 바쁜 현대인 입장에선 할게 못될듯...
5,최근 나온 신작중 가장 완성도 높다고 생각함
1,머틀 ㅇㄷ?
1,탈코르셋????? 그럼 나는 탈엔드필드ㅋㅋㅋㅋㅋ
4,"캐릭터 자체는 잘 나옴, 최적화 및 환경 작용이 괜찮음 공장 요소는 호불호 가 있음(팩토리오 계열 좋아하면 ㄱ추)"
5,재미있고 최적화가 좋다 스토리가 흥미롭고 다음이 기대된다 캐릭터들이 매우 매력적이다
5,컬리티도 너무 좋고 캐릭터들도 예뻐요
1,재미없음
5,지능낮은애들한테는 어려운게임
5,인생겜인데 학업으로. 쉼 ㅋㅋㅋㅋㅋㅋㅋㅋㅋ
1,아 좀 픽업 열리면 뽑을 수 있게 하라고. 왜 업데이트 돼도 뽑으면 손해보게 만들었는데.
3,"개인적으로 bm이 조금..;; 근데 솔직히 bm은 버티면 어케 할수있지만 공장은 진짜 호불호가 매우갈리고 시간이 너무갈려서 개인적으로는 취양맞고 시간여유가 있다 싶은분만 추천드리고 나는 시간이 없다 or 공장이 취양이 아니다 하는 분들은 진지하게 다시 생각하시고 하시길 3점대에 있을만한겜인가? 원신,명조같은겜 생각하고 오셨으면 3점 초중반정도의 게임 공장겜으로서는 4점중반 최적화는 칭찬할민함"
5,재미는 개인의 편차가 있다지만 종합적인 게임성에서 만큼은 그 누구도 별로라고 하는 사람이 없을 정도로 그 완성도는 높습니다. 불호일거같아서 찍먹하기 무서운 분들은 pc로 시작해보는것을 추천. 모바일은 서브로 생각해야 할 듯.
1,괜히 짱X회사가 아니었네. 이회산 다신안쳐다보련다
4,잘못키운 캐릭터 초기화 기능 넣어주면 안될까요....... 다른건 다좋아요.
5,완벽하다 캐릭터 육성과 심시티의 조합 허나 업데이트 속도가 느린건 조금 맘에 들지 않는다. 최적화도 완벽에 가깝다 피씨던 폰이던 다 잘 돌아간다. 앞으로가 더 기대되는 게임
1,개같은 기질 확률 니네 다 해먹어라. 게임 그렇게 내면 살림살이 나아지냐? 칵퉤
1,3시즌 다 픽업캐 못 가져가고 여풍만 2개 뜨네 에휴... 나는 이 게임이랑은 안 맞나보다 잘가라 ㅂㅂ
3,샤오미피드7로 게임을 하는데 앱처음키자마자바로튕기고 그리고 게임진행할때도 자꾸튕겨서 게임진행하기가 어려워 이런점을 고쳐줬으면 좋겠어요.
5,진짜 너무 재밌슴 ㄹㅇ
5,이본 안나와서 게임접음요
5,재미있음
1,무슨 가챠 천장 을 쳐도 픽업 캐릭터 가 안나오는게 말이되냐 아무리 확률 공개 했다 치지만 천장 쳤으면 나와야 하는게 아닌가 이미 풀돌 찍은 애들 만 잔뜩 나와서 삭제함
2,돈 많고 시간 많은 사람만 하셈.
5,모바일 조작감 매우 불편함 PC로 하길 추천
1,이런 뽑기 망겜 이월 왜 안돼?
5,"주관적으로 평가하자면 그래픽:10/10 세세한 디테일, 표정묘사까지 업계 최고수준이라고 생각하고, 스킬 이펙트도 훌륭하다고 느꼈습니다 최적화:9/10 이런류 게임은 보통 모바일 게임이라고는 하지만, 거의 pc에서 하라고 만든 느낌이었는데 pc, 모바일 둘다 해봄으로써 최적화도 타 게임에 비해 훨씬 쾌적하게 돌아갔습니다 게임성:9/10 무엇보다 공장 시스템이 너무 재미있습니다 내가 직접 만든 공장이 점점 발전하고, 생산량도 꾸준히 늘어가는게 재미있었지만 전기까는게 너무 귀찮아요ㅜㅜ 스토리 및 한국어 더빙:4/10 개인적으로 스토리는 재미가 없습니다 메인스토리가 메인스토리가 아니라 다른겜 서브퀘 하러다니는거마냥 지루하고 메인스에서만 느낄수 있는 감동? 같은것들이 부족합니다 더빙 면에서도 솔직히 많이 부족하다고 생각합니다만 스토리는 차차 개선될거라고 생각합니다 배경음 및 효과음:7/10 무난합니다 성장 재화 및 픽업재화:7/10 이거도 적당합니다 500자 제한 슬퍼요 ㅜㅜ"
5,"게임 만듦새는 좋고 틀은 완벽함. 하지만 전투와 공장 두 가지의 전혀 다른 장르가 유저들 평가를 가름. 공장은 느긋하게 하지만 정교하고 복잡한 시스템이고, 전투는 격렬한게 각각의 맛이니까. 온갖 게임을 다 해보는 잡식성 게이머만 좋은 평가를 줄 듯. 일단 전반적으로 공장 비율이 많이 더 높다고 생각함. 근데 공장 잘 돌려서 얻는 이득은 캐릭터 스펙 상향 뿐이라는 아이러니. 그래서 둘 중 하나라도 온전히 즐기지 못하면 게임이 쓰레기로 느껴질 듯. 호불호 갈려서 점수 꼬라박았는데, 게임의 틀은 온전하니까 한... 반년? 지나면 정상궤도로 오르고 자기만의 확고한 방향성과 유저풀을 가지고 갈 듯"
2,"액션전투겜인줄알았는데비주얼좋은공장겜이였음. 머리 안 좋아서 도중에 포기함 공장건설 같은게임 좋아하시면 재밌게 하실듯,,"
1,☆☆강요되는 공장. 공장 컨텐츠에 지나치게 시간이 많이 든다. 무릉가면 물부터 끌어와야 한다. 공장을 강요하는 것에 비해 게임사가 제공해주는 유용한 청사진은 적고 유저들이 공유해주는 청사진을 이용해야 한다. 게임사의 일을 유저에게 떠맡기는 느낌. ☆넓은 필드를 직접 발로 뛰면서 중계기와 짚라인을 설치해야 한다. ☆☆지나치게 적은 사료에 픽뚫 확률75% 120연 가차를 하기 전까지 픽뚫 무한정 나옴. 캐릭 명함 20만원 정도라고 함. ☆☆무조건 리세해서 6성 상시캐릭를 들고 시작해야 하고 이마저도 상시캐릭과 픽업캐릭의 성능차이가 심함. ☆☆☆☆☆☆스토리가 너무 너무 노잼. 그냥 다 스킵 추천. 시간 아까움. 전투 개노잼. 플블캐들이 너무 매력 없음. 근데 이 BM은 무슨 자신감이지?
5,최적화 GOAT
1,로딩이 너무느림
5,이 게임 재밌네요
1,게임 드럽게 어렵고 복잡하네 레벨6찍고 게임 접은건 이 게임뿐이다
1,모든 경험에서 난잡함을 느낌
5,최적화를 어떻게 했길래 제 폰으로도 이게 돌아가나요... 대해묘...
5,초반에는 어떤재미인지 모르겠고 전투도 단조롭다 느꼈는데 공장 만드는재미랑 파티시너지 연계스킬 쓰는게 생각보다 재밌음
5,재밌긴함 스토리는 노잼이니 스킵추천
1,전투 관련해서는 최악 회피는 왜 존재하는건가 싶은 판정에다가 회피 타이밍도 안내해주는것과는 전혀 다름
5,그냥 말이 필요없는 꿀잼 게임
1,ip빨 게임 때깔만 좋음
3,전투 시스템이 뭔소린지 이해를 못하겠음 스택을 쌓고 터뜨리고 부착하고 뭐 어쩌고.. 그리고 스택을 쳐쌓으라는데 보이지가 않음. 스택이 대체 어디있는데??? 전투시스템이 너무 복잡하고 불친절함
5,굳
1,쓰레기
3,"호불호가 명확한 게임. 장점도 많지만 단점도 많다. 장점. 고퀄의 아트웍과 최적화. 요즘 오픈월드 치고 맵크기가 크지는 않지만 밀도있고 스케일도 크게 느껴짐. 서브컬쳐에서 보기힘든 팩토리겜. 엄청 하드하지 않고 적당히 즐길만 하다. 집라인 까는 재미가 있다. 파티 연계 위주의 독특한 전투방식. 연계기 터트리는 맛이 있다. 단점. 모바일로 하기 너무 어려운겜. 공장 짓기는 거의 불가능. UI가 예쁘긴한데 불편한 부분도 상당수 존재. 게임 패드는 더 불편하다. 일일 숙제가 지나치게 많음. 공장 물건 생산만 자동이고 그외 나머지 모든것, 희귀템 채집, 부품수거 등 모든것이 수동임. 캐릭터 육성 난이도가 굉장히 하드하고 오래걸림. 한달간 한파티도 완성못함. 육성은 복잡하고 어려운데 고난도 전투는 또 엄청 어려워서 육성과 컨트롤 둘다 받쳐주지 않으면 고난도 컨텐츠에서 그냥 불쾌함만 느끼게 될것. 그냥 전반적으로 게임이 라이트하지 않고 하드하다. 시간 빌게이츠들에게 이 게임을 추천함."
1,폰기종:Z플립5 우선 고사양폰은 아니니 어느정도 감안하고 시작했으나 화면이 너무 끊겨서 진행하는게 너무나도 어려움. 내 폰이 문제인건지 뭔지 한번씩 튕기기도함 튜토리얼+초반스토리 빌드업을 위해서라지만 스킵이 안됨.제대로 자율시작까지 시간이 너무 오래걸림. 끊김+튕김 으로 튜토리얼 마무리까지 3~40분정도 걸림
3,bm만 고치자 해묘야 제발. 공장은 딱 내스타일임
5,공장 너무 어렵다고 징징 거리고 그러는데 본인 뇌는 복잡한거 싫어하는 작고 아담한 피넛 브레인임 근데 문제 없이 공장 전부 이해하고 스토리 다 밀고 즐겁게 겜하는중임 눈이 달렸으면 설명 나올때 좀 읽어라 그냥 무지성 거인마냥 스킵 다 눌러 놓고 아 이게 뭐야 공장 너무 어려워 하지 말고
1,그냥 무소과금은 버린다 생각하는 bm구조 120뽑을 모아서 한번에 쓰게 만들었지만 120뽑 천장쳐도 무뽑은 천장을 못치기 때문에 추가로 캐릭터 뽑을 하지만 이월 안되서 엄청 비싸지고 그렇다면 명함만 먹으면 되는 것 아닌가? 120뽑 재화 모아서 꼴박하면 무뽑 주는데 이걸 안주고 버틴다? 말이 안되는 구조 찍먹 비틱도 안되는데 걍 무소과금은 미래가 없음
2,"애매하네 캐릭터랑 전체적인 디자인 표현력은 취향인데 bm이 진짜 에바임 이월없고 천장도 있는건지 없는건지 설명도 불친절함 장비도 캐릭터 뽑기를 해야 얻는 재화로 뽑기가 가능함 어이가 없음 게임이 전체적으로 유저에게 이해시키려는 방법도 애매하게 표현함 스토리도 이해가 안감 텍스트 개많음 흥미가 안감 이해가 안가서 캐릭터 표현력은 좋음 밈도 재밌고 근데 그게 다임 파밍도 개 귀찮음 갔던 곳 또 가고 반복 노가다 하품이 나올 정도로 지루함 캐릭터 성장 개빡임 하나 다 키우는데 엄청 오래걸림 에너지 차는 속도가 개느려서 근데 개선하려는 의지가 보임 설문조사하기 시작하고 갑자기 뭘 퍼줌 근데 이것도 애매한 양임 그리고 스토리 다 밀면 이제 뭘 할지 모르겠음 할게 솔직히 없음.. + 현재 재화 많이 퍼준다고 착각하는 이유 숫자가 많아서;; 사실상 이 게임은 1뽑당 500개임 그런데 이벤트로 400, 800개로 많이 준다고 착각하고 있음 사실상 1뽑, 2뽑씩 찔끔찔끔 주고 있음"
5,첨에 시작하면 뭐부터 할지 고민 되는데 막상 하다보면 결국엔 다 할수 있게 한게 엄청 좋은거 같네요 다만 BM는 약간 뽑기 시스템이 운빨 심하게 적용되는게 참 애매한거 같네요 나머지 BM는 나쁘진 않는듯 합니다 하루에 2~3시간씩은 순삭되는 겜입니다
5,청사진 이나 일괄 조작으로 선택한 것들을 배치할때 뒤집기 기능 있으면 참 좋겠다
3,지역별 건설 설치 제한 걸려있는게 너무 아쉽다 짚라인은 적어도 50개는 박고 싶은데 20개는 너무 적음
